key,title,year,month,day,journal,issn,volume,issue,pages,authors,url,language,publisher,location,abstract,notes,doi,keywords,pubmed_id,pmc_id
rayyan-735664027,Comparison of sub-lethal metabolic perturbations of select legacy and novel perfluorinated alkyl substances (PFAS) in Daphnia magna,2022,NA,NA,Environmental Research,NA,212,NA,NA,NA,https://www.scopus.com/inward/record.uri?eid=2-s2.0-85131361121&doi=10.1016%2fj.envres.2022.113582&partnerID=40&md5=bac1593720f8f070385b8228cbfcaee1,NA,NA,NA,"Per- and polyfluoroalkyl substances (PFAS) are a class of pollutants of concern due to their ubiquitous presence, persistence, and toxicity in aquatic environments. Legacy PFAS pollutants such as perfluorooctanesulfonic acid (PFOS) and perfluorooctanoic acid (PFOA) have been more widely studied in aquatic environments. However, replacement PFAS, such as ammonium perfluoro (2-methyl-3-oxahexanoate; GenX) are increasingly being detected with little known information surrounding their toxicity. Here, Daphnia magna, a model organism for freshwater ecotoxicology was used to compare the acute sub-lethal toxicity of PFOS, PFOA, GenX, and PFAS mixtures. Using liquid chromatography with tandem mass spectrometry (LC-MS/MS), the targeted polar metabolic profile extracted from single Daphnia was quantified to investigate perturbations in the exposure groups versus the unexposed organisms. Multivariate statistical analyses demonstrated significant non-monotonic separation in PFOA, GenX, and PFAS mixture exposures. Sub-lethal exposure to concentrations of PFOS did not lead to significant separation in multivariate analyses. Univariate statistics and pathway analyses were used to elucidate the mode of action of PFAS exposure. Exposure to all individual PFAS led to significant perturbations in many amino acids including cysteine, histidine, tryptophan, glycine, and serine. These perturbations are consistent with biochemical pathway disruptions in the pantothenate and Coenzyme A (CoA) biosynthesis, thiamine metabolism, histidine metabolism, and aminoacyl-tRNA biosynthesis pathways. Overall, the collected metabolomic data is consistent with disruptions in energy metabolism and protein synthesis as the primary mode of action of sub-lethal PFAS exposure. Secondary modes of action among individual pollutant exposures demonstrated that the structural properties (carboxylic acid vs. sulfonic acid group) may play a role in the metabolic perturbations observed. Sub-lethal exposure to PFAS mixtures highlighted a mixed response when compared to the individual pollutants (PFOS, PFOA, and GenX). Overall, this study emphasizes the niche capability of environmental metabolomics to differentiate secondary modes of action from metabolic perturbations in both single pollutant and pollutant mixtures within the same chemical class. © 2022 Elsevier Inc.",NA,10.1016/j.envres.2022.113582,Ecotoxicology;Alkanesulfonic Acids;Fluorocarbons;Animals;Article;Chromatography;animal;fluorocarbon;nonhuman;unclassified drug;controlled study;Environmental Pollutants;pollutant;perfluoro compound;liquid chromatography-mass spectrometry;perfluorooctanesulfonic acid;perfluorooctanoic acid;alkanesulfonic acid;liquid chromatography;tandem mass spectrometry;Tandem Mass Spectrometry;mass spectrometry;ecotoxicology;Perfluorooctanoic acid (PFOA);metabolism;pantothenic acid;thiamine;limit of quantitation;glycine;threonine;glutamic acid;multiple reaction monitoring;fluorination;metabolite;electrospray;correlation analysis;Liquid chromatography tandem mass spectrometry (LC-MS/MS);energy metabolism;statistical significance;metabolomics;porphyrin;Daphnia;Daphnia magna;tryptophan;biosynthesis;cysteine;arginine;serine;discriminant analysis;proline;tyrosine;adenosine phosphate;protein synthesis;Liquid;pathway analysis;partial least squares regression;dopamine;ademetionine;aminoacyl transfer RNA;coenzyme A;cytidine phosphate;glucose 6 phosphate;guanosine;guanosine phosphate;histidine;sublethal concentration;freshwater;Perfluorooctanesulfonic acid (PFOS);2 methyl 3 oxahexanoate;Ammonium perfluoro(2-methyl-3-oxahexanoate) (GenX);dextro glutamic acid;dicarboxylic acid;Environmental metabolomics;glyoxylic acid;Histidine;tyramine;univariate analysis,NA,NA
rayyan-735663448,Choose Your Poison - Space-Use Strategy Influences Pollutant Exposure in Barents Sea Polar Bears,2018,3,6,Environmental Science and Technology,"[""0013-936X"", ""1520-5851""]",52,5,3211-3221,NA,https://www.scopus.com/inward/record.uri?eid=2-s2.0-85043450661&doi=10.1021%2facs.est.7b06137&partnerID=40&md5=1e19c27b448da922936c5c7a1568c975,NA,NA,NA,"Variation in space-use is common within mammal populations. In polar bears, Ursus maritimus, some individuals follow the sea ice (offshore bears) whereas others remain nearshore yearlong (coastal bears). We studied pollutant exposure in relation to space-use patterns (offshore vs coastal) in adult female polar bears from the Barents Sea equipped with satellite collars (2000-2014, n = 152). First, we examined the differences in home range (HR) size and position, body condition, and diet proxies (nitrogen and carbon stable isotopes, n = 116) between offshore and coastal space-use. Second, we investigated how HR, space-use, body condition, and diet were related to plasma concentrations of polychlorinated biphenyls (PCBs), organochlorine pesticides (OCPs) (n = 113), perfluoroalkyl substances (PFASs; n = 92), and hydroxylated-PCBs (n = 109). Offshore females were in better condition and had a more specialized diet than did coastal females. PCBs, OCPs, and hydroxylated-PCB concentrations were not related to space-use strategy, yet PCB concentrations increased with increasing latitude, and hydroxylated-PCB concentrations were positively related to HR size. PFAS concentrations were 30-35% higher in offshore bears compared to coastal bears and also increased eastward. On the basis of the results we conclude that space-use of Barents Sea female polar bears influences their pollutant exposure, in particular plasma concentrations of PFAS. © 2018 American Chemical Society.",NA,10.1021/acs.est.7b06137,Female;Animals;Article;Hydrocarbons;Hydroxylation;animal;female;nonhuman;unclassified drug;carbon;nitrogen;Organic pollutants;plasma;polychlorinated biphenyl;Environmental Pollutants;pollutant;Mammals;chlorinated hydrocarbon;concentration (composition);pollution exposure;adult;perfluoroalkyl substance;PCB;Polychlorinated biphenyls;Polychlorinated Biphenyls;satellite data;seashore;organochlorine pesticide;Plasma concentration;organochlorine;Sea ice;Mammalia;polar bear;Pollutant exposures;Organochlorine pesticides;coastal zone;Offshore oil well production;Body condition;intoxication;sea ice;Polar bears;Ursidae;Arctic Ocean;bear;Ursus maritimus;habitat use;isotope;Chlorinated;Poisons;Barents sea;Barents Sea;body size;home range;Home range;Hydroxylated polychlorinated biphenyls;Offshores;Space use;Poisoning,NA,NA
rayyan-735665013,A Critical Review of Amphibian Per‐ and Polyfluoroalkyl Substance Ecotoxicity Research Studies: Identification of Screening Levels in Water and Other Useful Resources for Site‐Specific Ecological Risk Assessments.,2023,10,1,Environmental Toxicology &amp; Chemistry,0730-7268,42,10,2078-2090,NA,https://research.ebsco.com/linkprocessor/plink?id=3a62cb03-8483-3489-bc59-a3722f762220,eng,NA,NA,"With the goal of aiding risk assessors conducting site‐specific risk assessments at per‐ and polyfluoroalkyl substance (PFAS)‐contaminated sites, this critical review synthesizes information on the ecotoxicity of PFAS to amphibians in 10 amphibian species and 16 peer‐reviewed publications. The studies in this review consisted of spiked‐PFAS chronic toxicity experiments with perfluorooctane sulfonate (PFOS), perfluorooctanoic acid (PFOA), perfluorohexane sulfonate (PFHxS), and 6:2 fluorotelomer sulfonate (6:2 FTS) that evaluated apical endpoints typical of ecological risk‐based decision making (survival, growth, and development). Body mass was the most sensitive endpoint, showing clear and biologically meaningful population level adverse effect sizes (≥20% adverse effects). From these results, we recommend chronic no observed effect concentration (NOEC) screening levels of 590 µg/L for PFOS and 130 µg/L for PFOA. At or above recommended chronic lowest observed effect concentration screening levels of 1100 µg/L PFOS and 1400 µg/L PFOA, there is an increased chance of adverse biologically relevant chronic effects. Biologically relevant adverse effects were not observed for PFHxS and 6:2 FTS, so unbounded NOECs of 1300 µg/L PFHxS and 1800 µg/L 6:2 FTS are recommended. Screening levels are also provided for the concentration of PFAS in an amphibian diet, amphibian tissue, and moss substrate. In addition, we recommend bioconcentration factors that can be useful to predict concentrations of PFAS in amphibians using concentrations in water; these values are useful for food web modeling to understand risks to vertebrate wildlife that prey on amphibians. Overall, the present study provides a guide to the wealth of ecotoxicological research on PFAS conducted by our research group and highlights the need for additional work that would improve the understanding of chemical risks to amphibians. Environ Toxicol Chem 2023;42:2078–2090. © 2023 SETAC",NA,10.1002/etc.5695,Perfluorooctanoic acid;Perfluorooctane sulfonate;Ecological risk assessment;Water levels;Fluoroalkyl compounds;Amphibians;Risk Assessment,NA,NA
rayyan-735663963,Locally caught freshwater fish across the United States are likely a significant source of exposure to PFOS and other perfluorinated compounds,2023,NA,NA,Environmental Research,NA,220,NA,NA,NA,https://www.scopus.com/inward/record.uri?eid=2-s2.0-85146450993&doi=10.1016%2fj.envres.2022.115165&partnerID=40&md5=7357d0faafa90a58dc146d6520df7e59,NA,NA,NA,"Per- and polyfluoroalkyl substances, or PFAS, gained significant public and regulatory attention due to widespread contamination and health harms associated with exposure. Ingestion of PFAS from contaminated food and water results in the accumulation of PFAS in the body and is considered a key route of human exposure. Here we calculate the potential contribution of PFOS from consumption of locally caught freshwater fish to serum levels. We analyzed data for over 500 composite samples of fish fillets collected across the United States from 2013 to 2015 under the U.S. EPA's monitoring programs, the National Rivers and Streams Assessment and the Great Lakes Human Health Fish Fillet Tissue Study. The two datasets indicate that an individual's consumption of freshwater fish is potentially a significant source of exposure to perfluorinated compounds. The median level of total targeted PFAS in fish fillets from rivers and streams across the United States was 9,500 ng/kg, with a median level of 11,800 ng/kg in the Great Lakes. PFOS was the largest contributor to total PFAS levels, averaging 74% of the total. The median levels of total detected PFAS in freshwater fish across the United States were 278 times higher than levels in commercially relevant fish tested by the U.S. Food and Drug Administration in 2019–2022. Exposure assessment suggests that a single serving of freshwater fish per year with the median level of PFAS as detected by the U.S. EPA monitoring programs translates into a significant increase of PFOS levels in blood serum. The exposure to chemical pollutants in freshwater fish across the United States is a case of environmental injustice that especially affects communities that depend on fishing for sustenance and for traditional cultural practices. Identifying and reducing sources of PFAS exposure is an urgent public health priority. © 2022",NA,10.1016/j.envres.2022.115165,Alkanesulfonic Acids;Fluorocarbons;Humans;Rivers;chemical pollutant;Animals;Article;United States;animal;environmental exposure;fluorocarbon;nonhuman;controlled study;animal tissue;chemical substance;chemistry;perfluoro compound;water pollutant;chemical compound;fish;perfluorooctanesulfonic acid;concentration (composition);pollution exposure;alkanesulfonic acid;blood level;Perfluorinated compounds;human;serum;water;Great Lakes [North America];lake;Lakes;river;public health;pollutant source;freshwater environment;Water;Fish consumption;Water Pollutants;Chemical;freshwater fish;per-;polyfluoroalkyl substances (PFAS);Fish advisories;Perfluorooctanesulfonate (PFOS),NA,NA
rayyan-735663948,Unveiling Distribution of Per- and Polyfluoroalkyl Substances in Matched Placenta-Serum Tetrads: Novel Implications for Birth Outcome Mediated by Placental Vascular Disruption,2023,NA,NA,Environmental Science and Technology,NA,57,14,5782-5793,NA,https://www.scopus.com/inward/record.uri?eid=2-s2.0-85151394402&doi=10.1021%2facs.est.2c09184&partnerID=40&md5=093d21c56b584e3b3bc5f6e321bf74bf,NA,NA,NA,"The placenta is pivotal for fetal development and maternal-fetal transfer of many substances, including per- and polyfluoroalkyl substances (PFASs). However, the intraplacental distribution of PFASs and their effects on placental vascular function remain unclear. In this study, 302 tetrads of matched subchorionic placenta (fetal-side), parabasal placenta (maternal-side), cord serum, and maternal serum samples were collected from Guangzhou, China. Eighteen emerging and legacy PFASs and five placental vascular biomarkers were measured. Results showed that higher levels of perfluorooctanoic (PFOA), perfluorooctane sulfonic acid (PFOS), and chlorinated polyfluorinated ether sulfonic acids (Cl-PFESAs) were detected in subchorionic placenta compared to parabasal placenta. There were significant associations of PFASs in the subchorionic placenta, but not in the serum, with placental vascular biomarkers (up to 32.5%) and lower birth size. Birth weight was negatively associated with PFOA (β: −103.8, 95% CI: −186.3 and −21.32) and 6:2 Cl-PFESA (β: −80.04, 95% CI: −139.5 and −20.61), primarily in subchorionic placenta. Mediation effects of altered placental angiopoietin-2 and vascular endothelial growth factor receptor-2 were evidenced on associations of adverse birth outcomes with intraplacental PFOS and 8:2 Cl-PFESA, explaining 9.5%-32.5% of the total effect. To the best of our knowledge, this study is the first to report on differential intraplacental distribution of PFASs and placental vascular effects mediating adverse birth outcomes and provides novel insights into the placental plate-specific measurement in PFAS-associated health risk assessment. © 2023 American Chemical Society.",NA,10.1021/acs.est.2c09184,Alkanesulfonic Acids;Female;Fluorocarbons;Humans;Article;China;Pregnancy;Placenta;female;fluorocarbon;male;controlled study;biological marker;chemical substance;chemistry;Health risks;Polyfluoroalkyl substances;Chlorine compounds;Biomarkers;perfluorooctanesulfonic acid;perfluorooctanoic acid;chlorination;concentration (composition);pollution exposure;adult;alkanesulfonic acid;risk assessment;Risk assessment;sulfonic acid derivative;human;serum;newborn;blood sampling;Perfluorooctane sulfonic acids;polyfluoroalkyl substance;prenatal exposure;health risk;pregnancy;Prenatal exposure;birth weight;Guangdong;placenta;maternal serum;outcome assessment;Birth outcome;pregnancy outcome;cord serum;birth outcome;Per-;polyfluoroalkyl substances;per-;health risk assessment;Guangzhou;angiopoietin 2;Fetal development;mediation analysis;mediation effect;Mediation effect;vascular disruption;Vascular disruption;Vascular Endothelial Growth Factor A;Vascular functions;vasculotropin A;vasculotropin receptor 2,NA,NA
rayyan-735664202,"Occurrence, source apportionment, plant bioaccumulation and human exposure of legacy and emerging per- and polyfluoroalkyl substances in soil and plant leaves near a landfill in China",2021,NA,NA,Science of the Total Environment,NA,776,NA,NA,NA,https://www.scopus.com/inward/record.uri?eid=2-s2.0-85101590197&doi=10.1016%2fj.scitotenv.2021.145731&partnerID=40&md5=e2ffcfb71badf70b084fff6b1a5a6536,NA,NA,NA,"In this study, 17 legacy and emerging PFASs were investigated in soil and plant leaves near a valley-type landfill, which has been in operation for over 20 years. ΣPFASs concentrations ranged from 5.31 to 108 ng/g dw and 11.9 to 115 ng/g dw in the soil and leaf samples, respectively, and perfluorobutanoic acid (PFBA) was dominant in both soil and leaves. The concentrations of hexafluoropropylene oxide dimer acid (HFPO-DA), 6:2 chlorinated polyfluorinated ether sulfonic acid (F-53B) and 6:2 fluorotelomer sulfonic acid (6:2 FTS) were significantly higher than those of legacy PFOA and PFOS, indicating emerging alternatives were widely applied in the region. The integrated approach of PCA analysis, field investigation of relevant industrial activities in the study area, along with the Unmix model analysis quantitatively revealed that factories producing consumer products and the landfill were the major sources of PFASs in soil, accounting for 57% of total PFASs detected. Bioaccumulation factors (BAFs) of ΣPFASs in leaves varied from 0.37 to 8.59, and higher BAFs were found in camphor leaves. The log10BAFs in all plant leaves showed a linear decrease with increasing carbon chain lengths for individual PFCAs (C4–C8). The BAF values of HFPO-DA, F-53B and 6:2 FTS were 0.01–3.39, 0.04–6.15 and 0.01–6.33, respectively. The human health risk assessment of EDIs showed a decreasing trend with the increasing carbon chain lengths of PFCAs (C4–C9), and the PFASs EDI indicated further study on the human health risk via vegetable consumption be warranted. © 2021",NA,10.1016/j.scitotenv.2021.145731,Biochemistry;Alkanesulfonic Acids;Fluorocarbons;Humans;PFASs;Article;Environmental Monitoring;Bioaccumulation;China;concentration (parameter);environmental exposure;fluorocarbon;nonhuman;unclassified drug;carbon;Carbon;bioaccumulation;environmental monitoring;chemical substance;chemistry;Health risks;Polyfluoroalkyl substances;water pollutant;chemical compound;perfluorooctanoic acid;chlorination;pollution exposure;alkanesulfonic acid;perfluoroalkyl substance;source apportionment;quantitative analysis;risk assessment;Risk assessment;Hexafluoropropylene oxide;oxide;human;soil;polyfluoroalkyl substance;Soil;Soils;health hazard;polymerase chain reaction;health risk;Consumer products;landfill;plant leaf;Plant Leaves;Industrial activities;Waste Disposal Facilities;waste disposal facility;soil analysis;Land fill;Chain length;Plants (botany);Carbon-chain length;Water Pollutants;Human health risk assessment;Chemical;Bioaccumulation factor;dimer;Source apportionment;soil quality;camphor;Dryobalanops;Field investigation;Landfill;leaf area;Unmix model;vegetable consumption;Humanities;Humanism,NA,NA
rayyan-735663209,Characterization of the products of the heme detoxification pathway in malarial late trophozoites by X-ray diffraction,NA,NA,NA,NA,NA,NA,NA,NA,NA,NA,NA,NA,NA,NA,NA,10.1074/jbc.272.2.713,Heme,NA,NA
rayyan-735663598,Validated quantitation of underivatized amino acids in human blood samples by volatile ion-pair reversed-phase liquid chromatography coupled to isotope dilution tandem mass spectrometry,2002,5,1,ANALYTICAL CHEMISTRY,0003-2700,74,9,2034-2040,NA,NA,NA,NA,NA,"Quantitation of amino acids in complex matrixes without derivatization is advantageous; however, difficulties exist in both the separation and the detection of those compounds. A validated method that is based on the use of volatile ion-pair liquid chromatography coupled to stable isotope dilution tandem mass spectrometry has been developed for the simple and accurate quantitation of underivatized amino acids in biological samples. Sufficient separation of 22 underivatized amino acids was achieved on a C-18 column in 36 min using perfluoroheptanoic acid (PFHA) and trifluoroacetic acid (TFA) as mobile phase modifiers. The collisionally activated dissociation spectra of the amino acids were investigated and the transitions of [M + H](+) –> [M + H - 46](+), which are specific to a-amino acids, were used for the detection of most amino acids and their stable isotopes. The calibration curves were linear over the range of 0.10-100 mug/mL, and the detection limits were 0.03-20 pmol on column. The quantitative results by this method were compared with those by an established OPA-derivatization HPLC method in the assay of 8 human serum samples, and better recovery and precision data of this method were observed. The method was also applied to the neonatal screening for phenylketonuria (PKU) with dry blood spots, and the results were satisfactory. This is the first time that all proteinogenic amino acids have been quantified directly from biological extracts without any kind of derivatization. The technique shows potential for routine determination of amino acids and analogous compounds in complex matrixes.",NA,10.1021/ac0111917,Humans;Humanism;Humanities,NA,NA
rayyan-735663268,Fish Exhibit Distinct Fluorochemical and δ<SUP>15</SUP>N Isotopic Signatures in the St. Lawrence River Impacted by Municipal Wastewater Effluents,2022,2,23,FRONTIERS IN ENVIRONMENTAL SCIENCE,2296-665X,10,NA,NA,NA,https://www.scopus.com/inward/record.uri?eid=2-s2.0-85126196056&doi=10.3389%2ffenvs.2022.833164&partnerID=40&md5=17ef995362431e2c63f750292a82e740,NA,NA,NA,"We examined the influence of Montreal wastewater treatment plant (WWTP) effluents on two top predators, Walleye (Sander vitreus) and Sauger (Sander canadensis), with a focus on δ15N isotopic signatures and per- and polyfluoroalkyl substances (PFAS). These two fish species were collected in the summer 2013 in the St. Lawrence River upstream and downstream from a major WWTP, as well as in background sites (semi-remote lakes). Most of the δ15N variations for Sauger and Walleye are attributable to 1) δ15N values of the primary producers and sewage-derived particulate organic matter (SDPOM) at the base of the trophic food chain, 2) agricultural activities combined with biogeochemical processes, and 3) food web length. δ15N was significantly lower in fish collected in the effluent-mixed water masses than other sites of the St. Lawrence River, attributed to the SDPOM of the WWTP effluent. Relative to the background sites, certain PFAS were present at much higher levels in the St. Lawrence River, with profiles dominated by perfluoroalkyl sulfonates (PFSA). However, PFSA profiles generally remained consistent along the St. Lawrence River. PFOS levels in fish from the St. Lawrence exceeded the current Federal Environmental Quality Guidelines for protecting piscivorous mammals or birds. However, the human chronic daily intake of PFOS remained below current thresholds suggested by national agencies. Copyright © 2022 Kaboré, Goeury, Desrosiers, Vo Duy, Liu, Cabana, Munoz and Sauvé.",NA,10.3389/fenvs.2022.833164,PFAS;effluent;SDPOM;St. Lawrence River;wastewater;δ 15 N;sauger;walleye,NA,NA
