key,title,year,month,day,journal,issn,volume,issue,pages,authors,url,language,publisher,location,abstract,notes,doi,keywords,pubmed_id,pmc_id
rayyan-735663569,Hydroxylated and methyl sulfone PCB metabolites in adipose and whole blood of polar bear (<i>Ursus maritimus</i>) from East Greenland,2004,9,20,SCIENCE OF THE TOTAL ENVIRONMENT,"[""0048-9697"", ""1879-1026""]",331,1,125-141,NA,NA,NA,NA,NA,"Persistent methyl sulfone (MeSO2-) and hydroxylated (HO-) polychlorinated biphenyl (PCB) metabolites have emerged as important classes of environmental contaminants in vertebrate, aquatic biota and humans. In the present study, PCB, MeSO2-PCB and HO-PCB concentrations and congener patterns were determined in the whole blood and adipose tissue of male (n = 7) and female (n = 12) polar bears (Ursus maritimus) of random age (3-25 years of age), and collected in 1999-2001 from the Ittoqqortoormiit/Scoresby Sound area in central East Greenland. There was no significant difference (P<0.05) between males and females with respect to PCB or PCB metabolite concentrations in either tissue. The mean sum (Sigma) PCB concentrations were 7020+/-3366 ng/g lipid weight (lw) (range 2708-18148 ng/g lw) and 46.1+/-44.6 ng/g wet weight (ww) (range 12.6-204.2 ng/g ww) in adipose and blood, respectively. The mean Sigma-HO-PCB concentration in whole blood was 182.3+/-72.1 ng/g ww (range 93.8-382.1 ng/g ww). The mean Sigma-HO-PCB to Sigma-PCB concentration ratios in whole blood were 4.59+/-3.58 (range 1.03-11.88) and 8.30+/-5.56 (range 2.16-19.47) in females and males, respectively, which are the highest ratios reported so far for polar bears from any population, or for any free-ranging animal. Sigma-HO-PCB concentrations were greater than all other major classes of organochlorines i.e. Sigma-PCBs, Sigma-MeSO2-PCBs, Sigma-chlordanes (CHLs), Sigma-hexachlorocyclohexanes (HCHs) and Sigma-chlorobenzenes (CBzs). The mean Sigma-MeSO2-PCB concentrations were 699+/-836 ng/g lw (range 127-3920 ng/g lw) and 10.9+/-9.6 ng/g ww (range 4.3-52.1 ng/g ww) in the adipose and blood, respectively. Regardless of age and sex, in both adipose and whole blood the MeSO2-PCB congener pattern was dominated by 3'- and 4'-MeSO2-CB101 and -CB87, and 4-MeSO2-CB149 (approx. 70% of the Sigma-MeSO2-PCBs). Minor differences in the MeSO2-PCB congener pattern were observed between blood and adipose, which suggests the possible influence of metabolite structure on mobilization and/or deposition to the adipose tissue. Sixteen HO-PCB congeners and one di-HO-PCB congener were identified, and five HO-PCB isomers and one di-HO-PCB isomer were detected. However, congener patterns were dominated by 4'-OH-CB120, 4-HO-CB146/3-HO-CB153, 4-OH-CB187, 4'-HO-CB172, 4-HO-CB193 and 4,4'-di-HO-CB202 (>10 ng/g ww). HO-PCB congener patterns in whole blood were not significantly different (P<0.05) between males and females. Other chlorinated phenolic contaminants, pentachlorophenol (0.3+/-0.3 ng/g ww) and 4-HO-heptachlorostyrene (7.5+/-2.9 ng/g ww) were also detected in blood. To our knowledge, this is to first report comparing PCBs, MeSO2-PCBs and HO-PCBs in whole blood and adipose tissue in a free-ranging wildlife species. HO-PCBs and MeSO2-PCBs are both important circulating contaminants in polar bears from this eastern Greenland population. Given the known toxicities of PCB metabolites, this population of polar bear may be experiencing health risks due to exposure to a complex loading of organohalogen contaminants that include HO-PCB and MeSO2-PCB metabolites. (C) 2004 Elsevier B.V. All rights reserved.",NA,10.1016/j.scitotenv.2003.03.001,Hydroxylation;Sulfones,NA,NA
rayyan-735662969,Fluorine mass balance analysis in wild boar organs from the Bohemian Forest National Park,NA,NA,NA,NA,NA,NA,NA,NA,NA,NA,NA,NA,NA,NA,NA,10.1016/j.scitotenv.2024.171187,Trees,NA,NA
rayyan-735664351,Prenatal exposure to chlorinated polyfluoroalkyl ether sulfonic acids and perfluoroalkyl acids: Potential role of maternal determinants and associations with birth outcomes,2019,NA,NA,Journal of Hazardous Materials,NA,380,NA,NA,NA,https://www.scopus.com/inward/record.uri?eid=2-s2.0-85069556387&doi=10.1016%2fj.jhazmat.2019.120867&partnerID=40&md5=cea4f274a993bb13115548f08a911a78,NA,NA,NA,"Transplacental exposure to per/polyfluoroalkyl substances (PFASs) may impact fetal growth, but published evidence are still sparse and not in agreement. Moreover, little is known on the occurrence of emerging chlorinated polyfluorinated ether sulfonates (Cl-PFESAs, 6:2 and 8:2) in maternal-neonatal population. This study investigated eleven PFASs by analyzing 98 cord samples from Hangzhou, China. All target compounds can be transported across placenta, with highest median concentrations of 4.07, 1.05 and 0.731 ng/mL for PFOS, PFOA, and 6:2 Cl-PFESA. Older ages and higher pre-pregnancy BMI were associated with higher cord PFASs concentration; being primiparous was also significantly associated. Notably, after adjusting for potential confounders, PFOS was negatively associated with birth weight (β = −417.3 g, 95% CI: −742.1, −92.4, p = 0.011, per a log10 unit increase in exposure) and ponderal index (β = −0.005 g/cm3, 95% CI: −0.008, −0.002, p = 0.000). PFOS and PFHxS were also indicated to be associated with small for gestational age birth (SGA) (p < 0.05). Although no evidence of association was observed between Cl-PFESAs and birth outcomes in this study, the bioaccumulative properties and development toxicity of Cl-PFESAs deserve continuous concern. © 2019",NA,10.1016/j.jhazmat.2019.120867,Pollution;Female;Fluorocarbons;Humans;Article;Sulfonic Acids;Ethers;China;Pregnancy;Maternal Exposure;Pregnancy Outcome;body mass;concentration (parameter);female;fluorocarbon;perfluoroalkyl acid;unclassified drug;controlled study;chemical substance;perfluoro compound;chemical compound;concentration (composition);pollution exposure;adult;sulfonic acid derivative;human;Adult;major clinical study;blood;placental transfer;Hazardous materials;prenatal exposure;age;health impact;pregnancy;Prenatal exposure;Prenatal Exposure Delayed Effects;birth weight;umbilical cord blood;Potential sources;maternal effect;maternal exposure;pregnancy outcome;small for date infant;Birth outcomes;Zhejiang;chlorinated polyfluoroalkyl ether sulfonic acid;source identification;Hangzhou;Chlorinated polyfluorinated ether sulfonates;Per/polyfluoroalkyl substances;Potential source identification;Sulfones;Ether,NA,NA
rayyan-735663050,Tissue distribution of perfluorinated compounds in farmed freshwater fish and human exposure by consumption,NA,NA,NA,NA,NA,NA,NA,NA,NA,NA,NA,NA,NA,NA,NA,10.1002/etc.1758,Humanism;Humanities;Humans;Tissue Distribution,NA,NA
rayyan-735663358,Ecological effect and risk towards aquatic plants induced by perfluoroalkyl substances: Bridging natural to culturing flora,2017,NA,NA,CHEMOSPHERE,"[""0045-6535"", ""1879-1298""]",167,NA,98-106,NA,NA,NA,NA,NA,"In the present study, the concentrations and proportions of perfluoroalkyl substances (PFASs) in water and sediments (in different seasons) from the Qing River were investigated. The highest concentration of PFASs in water (207.59 ng L-1) was found in summer. The composition of PFASs in water changed with time, perfluorobutane sulfonate (PFBS) was the predominant compound in spring and summer, while long-chain PFASs, perfluorooctanoic acid (PFOA) and perfluorooctane sulfonate (PFOS), started to increase in autumn and winter. The PFASs concentration in sediments ranged from 0.96 to 4.05 ng g(-1) dw. The proportion of long-chain PFASs was higher than that of short-chain PFASs in sediments, the dominant component in sediments was PFOA with a contribution of 24.6-75.4% to total PFASs in sediments, followed by PFOS. The concentrations of PFASs in roots of emergent plants were relatively higher than those in submerged plants. However, the translocation effect of PFASs was not remarkable. Bioaccumulation factors (BAFs) of the aquatic plants indicated the absorption of PFASs were effective. BAFs in submerged plants basically increased with increasing chain length accordingly. In general, aquatic plants had the absorption preference for long-chain PFASs, especially PFOS, which was the predominant compounds in both submerged and emergent plants. Based on the results above, hornworts were selected to be cultivated indoor in the nutrient solution spiked gradient concentrations of PFOS to assess the general ecological risk. The results revealed that hornworts were resistant to PFOS and might be used as remediation flora to eliminate PFOS contamination. (C) 2016 Elsevier Ltd. All rights reserved.",NA,10.1016/j.chemosphere.2016.09.146,character(0),NA,NA
rayyan-735664380,(Persistent) Organic pollutants in Germany: results from a pilot study within the 2015 moss survey,2018,NA,NA,Environmental Sciences Europe,NA,30,1,NA,NA,https://www.scopus.com/inward/record.uri?eid=2-s2.0-85056402207&doi=10.1186%2fs12302-018-0172-y&partnerID=40&md5=f348bdc47fac39993c5d7c222993f04f,NA,NA,NA,"Background: Since 1990, every 5 years, moss sampling is conducted within the European moss monitoring programme to assess the atmospheric deposition of airborne pollutants. Besides many other countries, Germany takes regularly part at these evaluations. Within the European moss monitoring 2015, more than 400 moss samples across Germany were taken according to a harmonized methodology for the assessment heavy metal and nitrogen input. In a pilot programme, eight of these sites were chosen for additional investigations on a broad range of organic contaminants to evaluate their accumulation in moss and thereby their presence in atmospheric deposition in Germany. Target compound classes comprised polycyclic aromatic hydrocarbons (PAH), polychlorinated dibenzodioxins and –furans (PCDD/F), dioxin-like and non-dioxin-like polychlorinated biphenyls (dl-PCB, ndl-PCB), polyfluorinated alkyl substances, classical flame retardants as well as emerging chlorinated and brominated flame retardants. In total, 120 target compounds were analysed. For some analytes, comparisons of accumulation in moss and tree leave samples were possible. Results: Except for certain flame retardants, PFAS, and ndl-PCB, substances of all other compound classes could be quantified in moss samples of all sites. Concentrations were highest for PAH (40–268 ng g−1) followed by emerging flame retardants (0.5–7.7 ng g−1), polybrominated diphenyl ethers (PBDE; 0.3–3.7 ng g−1), hexabromocyclododecane (HBCD; 0.3–1.2 ng g−1), dl-PCB (0.04–0.4 ng g−1) and PCDD/F (0.008–0.06 ng g−1). Conclusions: Results show the widespread atmospheric distribution and deposition of organic contaminants across Germany as well as the suitability of moss as bioaccumulation monitor for most of these compound classes. Compared to nearby tree leaf samples, accumulation potential of moss appeared to be higher for pollutants of high octanol–air partition coefficient (KOA) and octanol–water partition coefficient (KOW). © 2018, The Author(s).",NA,10.1186/s12302-018-0172-y,Biomonitoring;Halogenated flame retardants;biomonitoring;bioaccumulation;persistent organic pollutant;concentration (composition);flame retardant;PCB;heavy metal;Germany;PAH;sampling;dioxin;ether;atmospheric deposition;atmospheric pollution;partition coefficient;Dioxins;Atmospheric deposition;BFR;biological survey;Bryophyta;DBDPE;Dechlorane Plus;European moss survey;HFR;moss;Pilot Projects,NA,NA
rayyan-735664959,An assessment of the toxicological significance of anthropogenic contaminants in Canadian arctic wildlife,2005,11,15,Science of the Total Environment,0048-9697,351,NA,57-93,NA,https://research.ebsco.com/linkprocessor/plink?id=b39b0114-96fb-3834-97af-32d5e92f0589,eng,NA,NA,"Abstract: Anthropogenic contaminants have been a concern in the Canadian arctic for over 30 years due to relatively high concentrations of bioaccumulating and biomagnifying organochlorine contaminants (OCs) and toxic metals found in some arctic biota and humans. However, few studies have addressed the potential effects of these contaminants in Canadian arctic wildlife. Prior to 1997, biological effects data were minimal and insufficient at any level of biological organization. The present review summarizes recent studies on biological effects related to contaminant exposure, and compares new tissue concentration data to threshold effects levels. Weak relationships between cadmium, mercury and selenium burdens and health biomarkers in common eider ducks (Somateria mollissima borealis) in Nunavut were found but it was concluded that metals were not influencing the health of these birds. Black guillemots (Cepphus grylle) examined near PCB-contaminated Saglek Bay, Labrador, had enlarged livers, elevated EROD and liver lipid levels and reduced retinol (vitamin A) and retinyl palmitate levels, which correlated to PCB levels in the birds. Circulating levels of thyroid hormones in polar bears (Ursus maritimus) were correlated to PCB and HO-PCB plasma concentrations, but the impact at the population level is unknown. High PCB and organochlorine pesticide concentrations were found to be strongly associated with impaired humoral and cell-mediated immune responses in polar bears, implying an increased infection risk that could impact the population. In beluga whale (Delphinapterus leucas), cytochromes P450 (phase I) and conjugating (phase II) enzymes have been extensively profiled (immunochemically and catalytically) in liver, demonstrating the importance of contaminants in relation to enzyme induction, metabolism and potential contaminant bioactivation and fate. Concentrations of OCs and metals in arctic terrestrial wildlife, fish and seabirds are generally below effects thresholds, with the possible exception of PCBs in burbot (Lota lota) in some Yukon lakes, Greenland shark (Somniosus microcephalus), glaucous and great black-backed gulls (Larus hyperboreus and L. marinus), and TEQs of dioxin-like chemicals in seabird eggs. PCB and DDT concentrations in several arctic marine mammal species exceed effects thresholds, although evidence of stress in these populations is lacking. There is little evidence that contaminants are having widespread effects on the health of Canadian arctic organisms, with the possible exception of polar bears. However, further research and better understanding of organohalogen exposure in arctic biota is needed considering factors such as tissue levels that exceed effects thresholds, exposure to “new” organohalogen contaminants of concern, contaminated regions, and climate change.",NA,10.1016/j.scitotenv.2005.01.051,Vitamin A;Carnivora;Pollutants;Fat-soluble vitamins,NA,NA
rayyan-735663850,Two for the Price of One: Deriving Per- and Polyfluoroalkyl Substances (PFAS) Fillet and Whole-Body Conversion Equations in Fish,2024,NA,NA,Environmental Science and Technology Letters,NA,NA,NA,NA,NA,https://www.scopus.com/inward/record.uri?eid=2-s2.0-85187117947&doi=10.1021%2facs.estlett.4c00033&partnerID=40&md5=87cf5da81e3a95b227a1b63987452e81,NA,NA,NA,"Per- and polyfluoroalkyl substances (PFAS) pose risks to both human and ecological health. Fish consumption advisories are typically based on fillet concentrations, whereas environmental risk assessment for biota depends on whole-body fish concentrations. Reliable equations for conversion between fillet and whole-body concentrations would allow for a single analysis of a fish to function for both human and ecological risk assessment. However, conversion equations do not exist for multiple species, and previous estimates are based on small sample sizes. Here, we assess relationships in 21 fish species and provide conversion equations for perfluorooctanesulfonic acid (PFOS), perfluorodecanoic acid (PFDA), perfluoroundecanoic acid (PFUnA), and perfluorododecanoic acid (PFDoA), four of the most common PFAS detected in fish from New York State. We analyzed 429 fish from 15 water bodies as separate fillet and remainder portions and then used the concentrations and weights of these portions to synthesize a whole-body fish concentration. Using linear models combining all species, the ratio of fillet to whole-body concentrations ranged from 1.77 to 1.91 across the four PFAS chemicals. Total PFAS conversion factors are 1.86 for fillet to whole-body and 0.52 for whole-body to fillet. These values showed consistency among PFAS chemicals, but values of models combining species were lower than those of species-specific models, suggesting the latter are ideal for risk assessment. © 2024 American Chemical Society",NA,10.1021/acs.estlett.4c00033,Biochemistry;Fish;PFOS;Ecology;bioaccumulation;Health risks;Polyfluoroalkyl substances;Risk assessment;Ecological risk assessment;Perfluorodecanoic acid;Biota monitoring;Perfluoroundecanoic acid;Human health risk assessment;ecological risk assessment;biota monitoring;Conversion equation;human health risk assessment;Perfluorododecanoic acid;Perfluorooctanesulphonic acid;PFDA;PFDoA;PFUnA;Whole-body,NA,NA
rayyan-735663849,Trend of PFAS concentrations and prediction of potential risks in Taihu Lake of China by AQUATOX,2024,NA,NA,Environmental Research,NA,251,NA,NA,NA,https://www.scopus.com/inward/record.uri?eid=2-s2.0-85188026664&doi=10.1016%2fj.envres.2024.118707&partnerID=40&md5=f14efe9ffbdbe1f92a4315194883c831,NA,NA,NA,"Per- and polyfluoroalkyl substances (PFAS) are recognized as emerging environmental pollutants due to their high persistence and toxicities to humans and animals. Understanding the temporal trend of PFAS in the environment is important for their pollution control and making appropriate policies. Many studies have reported the PFAS concentrations in Taihu Lake, the third largest lake in China, while their temporal trend during the years was seldom investigated. This study summarizes the PFAS concentrations in the water, sediment and organisms in Taihu Lake from 2009 to 2020 to depict their temporal trends. Meanwhile, the ecological model of AQUATOX was applied to evaluate and predict the potential risks of PFAS from 2012 to 2030. The results showed that the total PFAS concentrations varied but without distinct increase or decrease in both water and sediment during the years, while PFAS concentrations in organisms significantly decreased. The yearly mean concentrations of perfluorooctanoic acid (PFOA) and perfluorooctane sulfonate (PFOS) in the water were 21.7–25.4 ng/L and 9.7–26.5 ng/L respectively, lower than the Standards for Drinking Water Quality of China and the suggested water quality criteria to protect the aquatic organisms. In sediment, PFOA and PFOS concentrations were 0.16–0.69 ng/g and 0.15–0.82 ng/g respectively, much lower than the recommended sediment quality guideline values. Based on the AQUATOX prediction, there will be no major threats caused by PFAS to the growth of biota in Taihu Lake in the near future, while the biomass of some species (e.g. carp) will be affected under the perturbation of PFAS. Both field investigation and AQUATOX simulation showed that PFOS concentrations in invertebrates and fish descend steadily, while no remarkable decrease in PFOA concentrations was expected. This study suggests a decreasing ecological risk of PFAS in Taihu Lake, while highlights the necessity of continuous monitoring of PFAS contamination. © 2024 Elsevier Inc.",NA,10.1016/j.envres.2024.118707,PFAS;Article;Perfluorooctane sulfonates;Temporal trends;China;nonhuman;unclassified drug;controlled study;environmental monitoring;pollutant;Polyfluoroalkyl substances;perfluorooctanesulfonic acid;perfluorooctanoic acid;Perfluorooctanoic acid;environmental management;prediction;tandem mass spectrometry;perfluorohexanoic acid;risk assessment;sulfonic acid derivative;biota;Environmental pollutants;ultra performance liquid chromatography;water;carboxylic acid derivative;drinking water;growth rate;Potable water;perfluoroalkyl carboxylic acid;polyfluoroalkyl substance;water contamination;sediment;trend study;lake;Lakes;carp;Lake pollution;Forecasting;toxic substance;water pollution control;salmonine;Sediments;water supply;perfluoroalkyl sulfonic acid;persistence;Water;environmental risk;Aquatic organisms;perfluorobutane sulfonic acid;Sediment;invertebrate;water quality;Water quality;pollution control;Quality control;organisms;biomass;catfish;simulation;Substance concentrations;per;phytoplankton;AQUATOX;bioaccumulation factor;bioconcentration factor;Organism;perch;Pollution control;Potential risks;sediment-water interface;Taihu Lake;Taihu lakes,NA,NA
rayyan-735663809,Removal of per- and polyfluoroalkyl substances by activated hydrochar derived from food waste: Sorption performance and desorption hysteresis,2024,NA,NA,Environmental Pollution,NA,340,NA,NA,NA,https://www.scopus.com/inward/record.uri?eid=2-s2.0-85175558758&doi=10.1016%2fj.envpol.2023.122820&partnerID=40&md5=d88f1ff5c22c8b43f2415cc0c88df7b9,NA,NA,NA,"Carbonaceous materials, derived from waste biomass, have proven to be a viable and appealing alternative for removing emerging micro-pollutants, such as per- and polyfluoroalkyl substances (PFAS). To assess the feasibility and efficacy of using material derived from food waste to alleviate PFAS pollution, this study prepared activated hydrochar (AHC) for sorbing ten PFAS, including five perfluoroalkyl carboxylic acids (PFCA; C4–C8), three perfluoroalkyl sulfonic acids (PFSA; C4, C6, C8), and two emerging PFAS, namely hexafluoropropylene oxide dimer acid (commercial name GenX, an alternative to perfluorooctanoic acid (PFOA)) and 6:2 fluorotelomer sulfonic acid (6:2 FTS). The results demonstrated that AHC possessed a relatively high specific surface area (207 m2/g) and hydrophobic surface properties. At environmentally relevant concentrations (40 μg/L), the sorption partition coefficients (log Kd) of PFAS on AHC ranged from 2.33 to 6.49 L/kg. Notably, GenX exhibited a lower log Kd value (2.33 L/kg) than PFOA (3.88 L/kg). The AHC showed favorable sorption performance for all tested PFAS, with log Kd values surpassing other reported sorbents (e.g., 0.83 for GenX on pyrochar, and 2.83 for PFOA on commercial biochar). Additionally, desorption hysteresis was observed for all PFAS, except for PFOA, and was particularly pronounced in PFBA, GenX, and 6:2 FTS at high initial concentrations, with Hysteresis Index (HI) values varying from 0.31 to 1.45, 0.68 to 1.88, and 0.51 to 1.85, respectively. Given its robust sorption capacity and desorption hysteresis toward PFAS, AHC is expected to be a favorable candidate for remediating PFAS-contaminated water. This study underscores, for the first time, the potential of food waste-derived hydrochar as an efficient sorbent for alleviating PFAS contamination, and further study is needed to investigate the sorption and desorption behaviors of PFAS on AHC at various environmental conditions. © 2023 Elsevier Ltd",NA,10.1016/j.envpol.2023.122820,PFAS;Article;concentration (parameter);environmental chemical;unclassified drug;controlled study;environmental monitoring;hydrophobicity;Polyfluoroalkyl substances;perfluorooctanoic acid;Perfluorooctanoic acid;environmental management;desorption;sulfonic acid derivative;ecosystem restoration;remediation;water contamination;Water pollution;Desorption;surface area;waste component removal;environmental factor;Hydrophobicity;GenX;chemical reaction kinetics;feasibility study;scoring system;Surface chemistry;Sulphonic acids;polyfluoroalkyl;Fluorotelomers;6:2 fluorotelomer sulphonic acid;6:2 FTS;biochar;Carbonization;charcoal;Desorption hysteresis;food waste;Food waste;Genx;Hydrothermal carbonization;hysteresis;Hysteresis;pollutant removal;Sorption/desorption;Food,NA,NA
