key,title,year,month,day,journal,issn,volume,issue,pages,authors,url,language,publisher,location,abstract,notes,doi,keywords,pubmed_id,pmc_id
rayyan-735664258,Lethal and sublethal toxicity of perfluorooctanoic acid (PFOA) in chronic tests with Hyalella azteca (amphipod) and early-life stage tests with Pimephales promelas (fathead minnow),2021,NA,NA,Ecotoxicology and Environmental Safety,NA,207,NA,NA,NA,https://www.scopus.com/inward/record.uri?eid=2-s2.0-85090414565&doi=10.1016%2fj.ecoenv.2020.111250&partnerID=40&md5=3545c914c9d898ed4dd77b437f3c2354,NA,NA,NA,"Perfluoroalkyl substances (PFAS), including perfluorooctanoic acid (PFOA), are industrial chemicals that are of concern due to their environmental presence, persistence, bioaccumulative potential, toxicity, and capacity for long-range transport. Despite a large body of research on environmental exposure, insufficient chronic aquatic toxicity data exist to develop water quality targets for clean-up of federal contaminated sites in Canada. Thus, our objective was to assess the aqueous toxicity of PFOA in chronic tests with Hyalella azteca (amphipod) and early-life stage tests with Pimephales promelas (fathead minnow). Toxicity data were analyzed based on measured PFOA concentrations. Amphipod exposures were 42 d (0.84–97 mg/L) and examined survival, growth, and reproduction. Fathead minnow exposures were 21 d (0.010–76 mg/L), which encompassed hatching (5 d) and larval stages until 16 d post-hatch; endpoints included hatching success, deformities at hatch, and larval survival and growth. Amphipod survival was significantly reduced at 97 mg/L (42-d LC50 = 51 mg/L), but growth and reproduction were more sensitive endpoints (42-d EC50 for both endpoints = 2.3 mg/L). Fathead minnows were less sensitive than amphipods, exhibiting no significant effects in all endpoints with the exception of uninflated swim bladder, which was significantly higher at 76 mg/L (15%) than controls (0%). Maximum concentrations of PFOA are generally in the ng/L range in global surface waters, but can reach the μg/L range in close proximity to major source inputs; therefore, environmental concentrations are well below those that caused toxicity in the current study. Our data will provide valuable information with which to assess the risk of PFOA at contaminated sites, and to set a target for site remediation. © 2020",NA,10.1016/j.ecoenv.2020.111250,Fish;Fluorocarbons;Animals;Article;Perfluoroalkyl substances;Canada;animal;concentration (parameter);environmental exposure;fluorocarbon;nonhuman;reproduction;Reproduction;controlled study;water pollutant;fish;perfluorooctanoic acid;concentration (composition);chronic toxicity;risk assessment;toxicity;drug effect;hatching;growth;growth rate;reproductive toxicity;water contamination;Pimephales promelas;toxicity testing;analysis;Caprylates;octanoic acid derivative;survival rate;surface area;bioremediation;freshwater environment;developmental stage;aging;EC50;Crustacea;sublethal effect;Water Pollutants;Amphipoda;water quality;life cycle;development;Chemical;larva;Larva;Cyprinidae;amphipod;crustacean;Water Quality;Growth;Hyalella azteca;Aquatic toxicity;Crustacean;water toxicity,NA,NA
rayyan-735664435,Exposure status of multiple environmental pollutants during pregnancy: based on biomonitoring data from Laizhou Wan Birth Cohort in Shandong,2019,NA,NA,Journal of Shanghai Jiaotong University (Medical Science),NA,39,4,421-427,NA,https://www.scopus.com/inward/record.uri?eid=2-s2.0-85066757927&doi=10.3969%2fj.issn.1674-8115.2019.04.017&partnerID=40&md5=798a8db01ae86328dd31450e1c92b070,NA,NA,NA,"Objective • To evaluate the levels of environmental pollutants including lead, mercury, organophosphorus pesticides (OPs), perfluoroalkyl and polyfluoroalkyl substances (PFASs) and triclosan (TCS) and further analyze the correlation between these pollutants in pregnant women. Methods • Pregnant women were recruited from the Laizhou Wan Birth Cohort (LWBC) in Shandong from September 2010 to December 2013. A total of 149 pregnant women were finally enrolled who completed questionnaires and provided sufficient biological samples for pollutants measurement including blood lead, blood mercury, urinary metabolites of OPs[dimethylphosphate (DMP), dimethylthiophosphate (DMTP), diethylphosphate (DEP), diethylthiophosphate (DETP), etc.], serum perfluorooctanoic acid (PFOA) and perfluorooctane sulfonate (PFOS), as well as urinary TCS. Spearman correlation analysis and cosine cluster analysis were used to explore the correlation between pollutants. Results • The detection rates of lead, DMP, PFOA and PFOS were all 100.0%. And the detection rates of mercury, DMTP, DEP, DETP and TCS were 89.3%, 81.2%, 97.3%, 96.6% and 59.1%, respectively. The median and range of concentrations for lead, mercury, PFOA, PFOS and TCS were 28.40 (11.30-65.70) μg/L, 0.85 (<LOD-10.98) μg/L, 39.54 (1.16-273.68) μg/L, 4.56 (0.55-15.38) μg/L, 0.58 (<LOD-58.01) μg/g, respectively. The median and range of concentrations for DMP, DMTP, DEP and DETP were 36.33 (0.55-1 331.04) μg/g, 2.65 (<LOD-128.84) μg/g, 14.70 (<LOD-585.05) μg/g, 1.84 (<LOD-86.21) μg/g, respectively. The concentrations of DMP and DEP were generally higher than those in developed countries. The concentration of PFOA was much higher than those in foreign studies, while the concentrations of PFOS and TCS were relatively lower. Correlation analysis and cosine cluster analysis revealed that mercury was positively correlated with PFOA (r=0.36, P=0.000) and PFOS (r=0.42, P=0.000). Conclusion • The population in LWBC is widely exposed to multiple pollutants and there are certain correlations between mercury and PFASs, suggesting that attention should be paid to emerging pollutants besides traditional ones. © 2019, Editorial Department of Journal of Shanghai Second Medical University. All right reserved.",NA,10.3969/j.issn.1674-8115.2019.04.017,Article;environmental exposure;female;unclassified drug;biological monitoring;pollutant;perfluorooctanesulfonic acid;perfluorooctanoic acid;perfluoroalkyl substance;human;lead;cohort analysis;polyfluoroalkyl substance;mercury;organophosphate pesticide;pregnancy;questionnaire;pregnant woman;triclosan;polyfluoroalkyl substances (PFASs);Perfluoroalkyl;Triclosan;Correlation analysis;diethylphosphate;diethylthiophosphate;dimethylphosphate;dimethylthiophosphate;Heavy metal;Organophosphorus pesticides (OPs);Pregnant woman;Pregnancy,NA,NA
rayyan-735663837,Maternal and neonatal effects of maternal oral exposure to perfluoro-2-methoxyacetic Acid (PFMOAA) during Pregnancy and Early Lactation in the Sprague-Dawley Rat,2024,NA,NA,Environmental Science and Technology,NA,58,2,1064-1075,NA,https://www.scopus.com/inward/record.uri?eid=2-s2.0-85181567919&doi=10.1021%2facs.est.3c08559&partnerID=40&md5=8fac74d5b54ddf62c8a6e57bbc3e8cbd,NA,NA,NA,"Perfluoro-2-methoxyacetic acid (PFMOAA) is a short-chain perfluoroalkyl ether carboxylic acid that has been detected at high concentrations (∼10 μg/L) in drinking water in eastern North Carolina, USA, and in human serum and breastmilk in China. Despite documented human exposure there are almost no toxicity data available to inform risk assessment of PFMOAA. Here we exposed pregnant Sprague-Dawley rats to a range of PFMOAA doses (10-450 mg/kg/d) via oral gavage from gestation day (GD) 8 to postnatal day (PND) 2 and compared results to those we previously reported for perfluorooctanoic acid (PFOA) and hexafluoropropylene oxide-dimer acid (HFPO-DA or GenX). Newborn pups displayed reduced birthweight (≤30 mg/kg), depleted liver glycogen concentrations (all doses), hypoglycemia (≤125 mg/kg), and numerous significantly altered genes in the liver associated with fatty acid and glucose metabolism similar to gene changes produced by HFPO-DA. Pup survival was significantly reduced at ≤125 mg/kg, and at necropsy on PND2 both maternal and neonatal animals displayed increased liver weights, increased serum aspartate aminotransferase (AST), and reduced serum thyroid hormones at all doses (≤10 mg/kg). Pups also displayed highly elevated serum cholesterol at all doses. PFMOAA concentrations in serum and liver increased with maternal oral dose in both maternal and F1 animals and were similar to those we reported for PFOA but considerably higher than HFPO-DA. We calculated 10% effect levels (ED10 or EC10) and relative potency factors (RPF; PFOA = index chemical) among the three compounds based on maternal oral dose and maternal serum concentration (μM). Reduced pup liver glycogen, increased liver weights and reduced thyroid hormone levels (maternal and pup) were the most sensitive end points modeled. PFMOAA was ∼3-7-fold less potent than PFOA for most end points based on maternal serum RPFs, but slightly more potent for increased maternal and pup liver weights. PFMOAA is a maternal and developmental toxicant in the rat producing a constellation of adverse effects similar to PFOA and HFPO-DA. © 2024 American Chemical Society. All rights reserved.",NA,10.1021/acs.est.3c08559,"PFAS;Female;Fluorocarbons;Humans;Animals;Article;Liver;Thyroid Hormones;United States;Genes;Pregnancy;Rats;Maternal Exposure;animal;female;fluorocarbon;Hormones;male;nonhuman;thyroid hormone;Thyroid hormones;animal experiment;animal tissue;perfluorooctanoic acid;Perfluorooctanoic acid;gene expression;risk assessment;Risk assessment;toxicity;Toxicity;Dimers;Fatty acids;human;serum;newborn;carboxylic acid;drinking water;Potable water;metabolism;cholesterol blood level;glucose;animal model;hormone;rat;Caprylates;liver weight;octanoic acid derivative;pregnancy;fatty acid;birth weight;cholesterol;ether;aspartate aminotransferase;aspartate aminotransferase blood level;Developmental toxicity;thyroid hormone blood level;Sprague Dawley rat;fatty acid metabolism;eosin;maternal exposure;3;North Carolina;lactation;Lactation;glucose metabolism;Sprague-Dawley;dimer;methoxyacetic acid;perfluoro-2-methoxyacetic acid;3-tetrafluoro-2-(heptafluoropropoxy)-propanoate;ammonium 2;Propionates;propionic acid;Birthweight;glycogen liver level;hematoxylin;Hepatic toxicity;hypoglycemia;Liver Glycogen;Maternal serum;Oral dose;side effect;Sprague-Dawley rats;Thyroid disruption;Infant, Newborn;Rats, Sprague-Dawley;Lactic Acid;Lactates",NA,NA
rayyan-735664607,Mineralization of perfluorooctanesulfonate (PFOS) and perfluorodecanoate (PFDA) from aqueous solution by porous hexagonal boron nitride: adsorption followed by simultaneous thermal decomposition and regeneration,2016,NA,NA,RSC Advances,NA,6,114,113773-113780,NA,https://www.scopus.com/inward/record.uri?eid=2-s2.0-85002271253&doi=10.1039%2fC6RA15564B&partnerID=40&md5=73971737d55115eeafe8d4c47688777f,NA,NA,NA,"Poly- and perfluoroalkyl substances (PFASs) are of global concern due to their toxicity, high persistency, bioaccumulation, and worldwide occurrence. Boron nitride (BN), consisting of light elements and bearing excellent thermal stability, has shown great potential in wastewater purification as a readily-recyclable sorbent. In this study, porous hexagonal BN nanosheets (h-BNs) were synthesized and for the first time their sorption capacities toward perfluorooctanesulfonate (PFOS) and perfluorodecanoate (PFDA) (two representative PFASs) were evaluated under various solution compositions. The h-BNs used after sorption were regenerated by calcining at 600 °C in air for 20 min. The h-BNs synthesized were found to have fast sorption kinetics for both PFOS and PFDA, and the sorption processes fitted well with the Freundlich model and pseudo-second-order kinetics. Under the conditions of 50 mg L−1 PFDA or PFOS, 0.2 g L−1 h-BNs, and pH 6.0, sorption capacities of ∼0.72 mg m−2 and ∼0.45 mg m−2 were achieved for PFDA and PFOS, respectively. The effects of H+ and Ca2+ showed that electrostatic interactions were responsible for the sorption. The reutilization experiments revealed that the h-BNs had a persistent sorption capacity after three cycles. To reduce the production of fluorine-containing gases, calcium hydroxide was used as a calcination additive and the fluorine-fixing product calcium fluoride was successfully detected. The results suggest that h-BN sorption may be a promising approach for the removal of PFASs from an aqueous solution. © The Royal Society of Chemistry.",NA,10.1039/C6RA15564B,Biochemistry;Perfluorooctane sulfonates;Solutions;Sorption;Fluorine compounds;Chemicals removal (water treatment);Freundlich models;Sorption capacities;perfluoroalkyl substance (PFASs);Poly;Calcination;Boron nitride;Calcium fluoride;Chemical elements;Decomposition;Fluorspar;Hexagonal boron nitride;Hydrated lime;III-V semiconductors;Lime;Nitrides;Pseudo second order kinetics;Solution composition;Wastewater purification;Adsorption;Regeneration,NA,NA
rayyan-735662816,Fractionation of perfluoroalkyl acids (PFAAs) along the aquatic food chain promoted by competitive effects between longer and shorter chain PFAAs,NA,NA,NA,NA,NA,NA,NA,NA,NA,NA,NA,NA,NA,NA,NA,10.1016/j.chemosphere.2023.137931,character(0),NA,NA
rayyan-735663776,Comprehensive Determination of 28 PFAS Compounds in Oyster Tissue: A QuEChERS Sample Preparation Coupled with UPLC-MS/MS,2024,NA,NA,Analytical Letters,NA,NA,NA,NA,NA,https://www.scopus.com/inward/record.uri?eid=2-s2.0-85182447847&doi=10.1080%2f00032719.2024.2302399&partnerID=40&md5=54b9e59db5217ee6f8676914e4d82933,NA,NA,NA,"Per- and polyfluoroalkyl substances (PFAS) are known to bioaccumulate in aquatic organisms, such as shellfish, and have been linked to adverse human health outcomes. Increasing attention has been focused on method development for the detection of PFAS in various media; however, these methods are typically tedious, require high solvent volumes, and are time consuming. The present method used a Quick, Easy, Cheap, Effective, Rugged, and Safe (QuEChERS) extraction approach and analysis by ultra-performance liquid chromatography coupled with tandem mass spectrometry (UPLC-MS/MS) to detect 28 PFAS in Eastern oyster (Crassostrea virginica) tissue. This method was validated using limit of detection, limit of quantitation, and precision and accuracy studies. Limits of detection ranged from 0.2 to 5.8 ng g−1, limits of quantitation ranged from 0.66 to 19.2 ng g−1, and recoveries spanned 52.1–105.9% at the 100 ng mL−1 analyte level. Analysis of 12 unknown oyster composite samples revealed the detection of PFHxA, PFPeS, PFOA, PFHpA and PFOS and at least two compounds were detected in each oyster sample. This validated method proved to be an efficient and environmentally friendly sample preparation method for PFAS analysis in complex tissue media, such as oysters. © 2024 Taylor & Francis Group, LLC.",NA,10.1080/00032719.2024.2302399,shellfish;QuEChERS;per-;Oyster;oysters;polyfluoroalkyl substances (PFAS);ultra-performance liquid chromatography coupled with tandem mass spectrometry (UPLC-MS/MS);Multiple Sclerosis,NA,NA
rayyan-735664553,Young-of-the-year fish as a prospective bioindicator for aquatic environmental contamination monitoring,2016,NA,NA,Water Research,NA,103,NA,334-342,NA,https://www.scopus.com/inward/record.uri?eid=2-s2.0-84979759207&doi=10.1016%2fj.watres.2016.07.046&partnerID=40&md5=39af43b54afb2aebb52d7d18bfec258b,NA,NA,NA,"Toxic metals (Hg, Cd, Pb) and fifteen perfluoroalkyl substances (PFASs) were determined in different fish samples at two locations on the Elbe River in the Czech Republic. The muscle tissue of the two adult fish species most commonly used as bioindicators in central Europe and whole body homogenates of various species of young-of-the-year (YOY) fish were used. The purpose of this study was to evaluate the potential to replace adult fish muscle tissue with YOY fish for contamination monitoring. All of the toxic metals and five of the fifteen PFASs were found in the YOY fish samples while only mercury and PFOS were detected in the muscle tissue of adults. The concentration of total mercury (THg) in the YOY fish homogenates ranged between 0.014 and 0.062 μg g−1. Of the spectrum of analysed pollutants, only the THg concentrations were lower in YOY fish homogenates than in adult muscle tissue. The cadmium concentration varied from 0.004 to 0.024 μg g−1 and the lead concentration varied from 0.032 to 0.396 μg g−1 in YOY fish homogenates, while in most of the adult samples, Cd and Pb were below the detection limit of the analytical methods employed. The PFOS concentrations in YOY fish homogenates were comparable to the concentrations frequently found in adult liver tissue. These results show that mixed shoals of YOY fish can be successfully used for aquatic bio-monitoring. Interspecific variability in the concentrations of the target pollutants in YOY fish whole body homogenates is usually lower than the intraspecific variability of the concentrations of the pollutants in adult fish muscle. YOY fish were found to be a suitable bioindicator and have several advantages compared to adult fish. © 2016 Elsevier Ltd",NA,10.1016/j.watres.2016.07.046,PFAS;Biomonitoring;Fish;Animals;Article;Environmental Monitoring;Perfluoroalkyl substances;Mercury;animal;nonhuman;biological monitoring;biomonitoring;biological marker;environmental monitoring;animal tissue;water pollutant;Muscle;bioindicator;Biomarkers;fish;concentration (composition);adult;homogenate;muscle;muscle tissue;liver;atomic absorption spectrometry;cadmium;lead;Elbe River;priority journal;metal;water contamination;mercury;mercury (element);Mercury (metal);limit of detection;aquatic environment;River pollution;feeding behavior;biodiversity;Fishes;cyprinid;prospective study;freshwater environment;Freshwater;Chemical detection;Czech Republic;Fresh Water;Prospective Studies;toxic material;Bream;Hyperoglyphe porosa;Water Pollutants;Chemical;Muscle tissues;Chub;Contamination monitoring;Fish homogenate;intraspecific variation;Leuciscus cephalus;Toxic metals;young of the year fish,NA,NA
rayyan-735662897,Advanced throughput analytical strategies for the comprehensive HRMS screening of organic micropollutants in eggs of different bird species,NA,NA,NA,NA,NA,NA,NA,NA,NA,NA,NA,NA,NA,NA,NA,10.1016/j.chemosphere.2022.137092,Ovum,NA,NA
rayyan-735664045,6:2 Chlorinated polyfluoroalkyl ether sulfonate as perfluorooctanesulfonate alternative in the electroplating industry and the receiving environment,2022,NA,NA,Chemosphere,NA,302,NA,NA,NA,https://www.scopus.com/inward/record.uri?eid=2-s2.0-85129515313&doi=10.1016%2fj.chemosphere.2022.134719&partnerID=40&md5=753d3cc449f9683ae089b2d52b46d109,NA,NA,NA,"Electroplating industry is an important application field of per- and polyfluoroalkyl substances (PFASs) as the chromium mist suppressants. 6:2 chlorinated polyfluoroalkyl ether sulfonate (6:2 Cl-PFAES) and perfluorooctanesulfonate (PFOS) have been the two widely used mist suppressants, and after the ban of PFOS, 6:2 Cl-PFAES will become the dominant suppressant. The behavior and mechanisms of 6:2 Cl-PFAES in the electroplating industry and the receiving environment were studied and compared with PFOS. 6:2 Cl-PFAES behaved similarly with PFOS due to their similar chemical structure. However, some difference exists for the relatively stronger hydrophobicity of 6:2 Cl-PFAES. Up to 35.7 mg/L of PFOS and 13.4 mg/L of 6:2 Cl-PFAES were found in the industrial wastewater influents, and were effectively reduced to 0.3–0.8 mg/L by the interaction with chromium hydroxide through hydrophobic interaction and ligand exchange. The stronger hydrophobicity of 6:2 Cl-PFAES than PFOS resulted in its accumulation in the surface of foams and comparable or less removal during the industrial and municipal wastewater treatment. 6:2 Cl-PFAES exhibited higher bioaccumulation potential than PFOS in the surface water. 6:2 Cl-PFAES emitted by both mists and water may pose health risks to humans. More attentions towards 6:2 Cl-PFAES are needed after the replacement of PFOS by it in the electroplating industry as a global contaminant of emerging concerns. © 2022 Elsevier Ltd",NA,10.1016/j.chemosphere.2022.134719,Biochemistry;Alkanesulfonic Acids;Fluorocarbons;Humans;PFAS alternatives;wastewater;PFOS;Surface waters;Article;Perfluorooctane sulfonates;Ether;Ethers;China;fluorocarbon;nonhuman;unclassified drug;bioaccumulation;Health risks;hydrophobicity;perfluoroalkanoic acid;Polyfluoroalkyl substances;Chlorine compounds;perfluorodecanoic acid;perfluorododecanoic acid;perfluorooctanesulfonic acid;perfluorooctanoic acid;perfluoroundecanoic acid;chlorination;marine environment;alkanesulfonic acid;perfluorohexanesulfonic acid;perfluorohexanoic acid;sulfonate;biota;human;water;foam;soil pollution;perfluorononanoic acid;perfluoroheptanoic acid;perfluoropentanoic acid;health hazard;perfluorobutanoic acid;chemical structure;ether derivative;Industrial wastewaters;Industrial water treatment;Wastewater treatment;waste water management;marine species;ether;sea food;perflubutane;waste component removal;Electroplating industry;Hydrophobicity;Water;surface property;chromium;Alkanesulfonates;surface water;Chromium;ligand;Sulphonates;wastewater treatment;6:2 cl-PFAES;6:2 Cl-PFAES;municipal wastewater;Hydrophobic interactions;Chemicals removal (water treatment);Polyfluoroalkyl substance alternative;Application fields;Chromium compounds;Electroplating;electroplating industry;electroplating wastewater;Foam;Hydrophobic ligand;hydroxide;Sulfones,NA,NA
rayyan-735664910,Accumulation of per- and polyfluoroalkyl substances (PFAS) in a terrestrial food web,2023,NA,NA,bioRxiv,NA,NA,NA,NA,NA,https://login.wwwproxy1.library.unsw.edu.au/login?url=https://www.proquest.com/working-papers/accumulation-per-polyfluoroalkyl-substances-pfas/docview/2901436647/se-2?accountid=12763,English,NA,NA,"Per- and polyfluoroalkyl substances (PFAS) are synthetic organofluorine chemical compounds that are broadly used in amongst others aqueous firefighting foam, cosmetics, textiles, carpets, coatings, plastics, and ski wax. Their chemical properties make them persistent organic pollutants that are potential bioaccumulative and toxic. Most studies on PFAS have been performed in groundwater, surface water and aquatic biota. Our knowledge on the terrestrial fate of PFAS is therefore limited. We sampled soil, berries, mushrooms, and wildlife on the island Froson, central Sweden, in 2021 and 2022, to study the fate of 22 PFAS in a terrestrial food web. Groundwater, surface water and fish on Froson have previously shown high PFAS concentrations. Soil, berries, and mushrooms were also concurrently sampled in a reference area in northern Sweden. Overall, concentrations of the sum of PFAS were low in berries and mushrooms. In moose (Alces alces), roedeer (Capreolus capreolus), and bank vole (Myodes glareolus), concentrations were highest in liver. The maximum levels for PFAS in offal as set by the European Commission (50 ng/g ww) were exceeded in the liver of two of 10 roedeer. Bank voles (n = 12 pools) that were sampled in the vicinity of a firefighting training site showed partly extreme concentrations with none of the samples having liver concentrations <474 ng/g ww (maximum 11,600 ng/g ww). Bioaccumulation factors (BAFs) for multiple PFAS in bank voles were higher for the studied mushrooms and soil compared to studied berries and were >100 for 27 out of 265 calculated BAFs. BAFs in the ungulate species were generally lower than those for bank voles but were >1 for several PFAS from the mushroom. The exact origin of PFAS in bank voles could not be identified in our study, but the BAFs are supported by the feeding and behaviour ecology of bank voles, i.e., there is likely bioaccumulation and biomagnification from soil and mushrooms to bank voles. The measured PFAS concentrations and BAFs, especially those in bank voles are worrying from an ecosystem and One Health perspective considering that voles are staple food for multiple predators.Competing Interest StatementThe authors have declared no competing interest.",NA,10.1101/2023.12.12.571392,Biology;Persistent organic pollutants;Sweden;Bioaccumulation;Groundwater;Cosmetics;Perfluorochemicals;Food webs;Food chains;Surface water;Textiles;Fruits;Rodents;Berries;Carpets;Feeding behavior;Mushrooms;Perfluoroalkyl & polyfluoroalkyl substances;Predators,NA,NA
