key,title,year,month,day,journal,issn,volume,issue,pages,authors,url,language,publisher,location,abstract,notes,doi,keywords,pubmed_id,pmc_id
rayyan-735664099,Quantifying Indirect Contribution from Precursors to Human Body Burden of Legacy PFASs Based on Paired Blood and One-Week Duplicate Diet,2022,NA,NA,Environmental Science and Technology,NA,56,9,5632-5640,NA,https://www.scopus.com/inward/record.uri?eid=2-s2.0-85128720709&doi=10.1021%2facs.est.1c07465&partnerID=40&md5=1a97e536af67ba32e52aa44f9748ecf9,NA,NA,NA,"The restriction on legacy perfluoroalkyl substances (PFASs) has led to increasing application and contamination of their precursors and novel alternatives. However, the indirect contribution from precursors has not been well characterized. In this study, 24 PFASs were measured in the paired human blood and urine from general volunteers (n = 20), as well as their corresponding exposure matrices (7 day duplicate diet, drinking water and dust). Perfluorooctanoic acid (PFOA) was predominant, followed by 6:2 chlorinated polyfluoroalkyl ether sulfonate (6:2 Cl-PFESA), contributing 21.6-47.0 and 6.6-20.0% of the total concentrations, respectively. Total oxidable precursor (TOP) assay and isomeric analysis coupled with a toxicokinetic model suggested that around 19% of perfluorooctane sulfonate (PFOS) in human was contributed by its precursors. The strong correlation between the estimated daily intake (EDI) and human blood concentration for 6:2 Cl-PFESA suggested that it was mainly contributed by direct exposure. The bioavailability of 6:2 Cl-PFESA in the food matrices was estimated as 18.6% by comparing the estimated and measured blood concentrations, implying that human exposure might be overestimated if the bioavailability of PFASs in food was not considered. Assuming that they had a similar bioavailability, it was estimated that ca. 20% of PFOS body burden was from indirect exposure to its precursors, which was supported by TOP assay. © 2022 American Chemical Society. All rights reserved.",NA,10.1021/acs.est.1c07465,Biochemistry;Fluorocarbons;Humans;PFASs;Article;Perfluoroalkyl substances;Perfluorooctane sulfonates;Dust;Blood;female;fluorocarbon;male;unclassified drug;controlled study;bioavailability;chemical substance;Human exposures;diet;perfluorooctanoic acid;pollution exposure;adult;alkanesulfonic acid;quantitative analysis;blood level;human;urine;water;drinking water;Potable water;Body burden;food intake;limit of detection;correlation;Diet;elimination half-life;signal noise ratio;body burden;Body Burden;isomer;dust;human tissue;perfluoroalkyl derivative;Human bloods;urinalysis;polyfunctional group;precursor;volume of distribution;human experiment;normal human;Alkanesulfonates;estimated daily intake;Blood concentrations;Human bodies;human exposure;Human urine;indirect exposure;Indirect exposure;Isomer profile;isomer profiles;peroxydisulfate potassium;polyfluoroalkyl ether sulfonate;Humanities;Humanism,NA,NA
rayyan-735664698,Perfluorooctane sulfonate (PFOS) contamination of fish in urban lakes: A prioritization methodology for lake management,2013,NA,NA,Water Research,NA,47,20,7264-7272,NA,https://www.scopus.com/inward/record.uri?eid=2-s2.0-84897081427&doi=10.1016%2fj.watres.2013.09.063&partnerID=40&md5=3ec4cbc47ea889e3359cb62a51c12d41,NA,NA,NA,"The contamination of urban lakes by anthropogenic pollutants such as perfluorooctane sulfonate (PFOS) is a worldwide environmental problem. Large-scale, long-term monitoring of urban lakes requires careful prioritization of available resources, focusing efforts on potentially impaired lakes. Herein, a database of PFOS concentrations in 304 fish caught from 28 urban lakes was used for development of an urban-lake prioritization framework by means of exploratory data analysis (EDA) with the aid of a geographical information system. The prioritization scheme consists of three main tiers: preliminary classification, carried out by hierarchical cluster analysis; predictor screening, fulfilled by a regression tree method; and model development by means of a neural network. The predictive performance of the newly developed model was assessed using a training/validation splitting method and determined by an external validation set. The application of the model in the U.S. state of Minnesota identified 40 urban lakes that may contain elevated levels of PFOS; these lakes were not previously considered in PFOS monitoring programs. The model results also highlight ongoing industrial/commercial activities as a principal determinant of PFOS pollution in urban lakes, and suggest vehicular traffic as an important source and surface runoff as a primary pollution carrier. In addition, the EDA approach was further compared to a spatial interpolation method (kriging), and their advantages and disadvantages were discussed. © 2013 Elsevier Ltd.",NA,10.1016/j.watres.2013.09.063,Fish;Alkanesulfonic Acids;Fluorocarbons;PFOS;PFASs;Persistent organic pollutants;Animals;Environmental Monitoring;Perfluoroalkyl substances;Perfluorooctane sulfonates;Minnesota;United States;nonhuman;Organic pollutants;environmental monitoring;fish;perfluorooctanesulfonic acid;surfactant;urban area;urbanization;article;Urbanization;Perfluorooctane sulfonate;priority journal;water contamination;pollution effect;lake;Lakes;Lake pollution;Reproducibility of Results;Fishes;Persistent organic pollutant (POP);validation process;numerical model;Cluster Analysis;Cities;Water Pollutants;Conservation of Natural Resources;screening test;lake pollution;water quality;Water quality;Chemical;Models;runoff;data base;Theoretical;water management;Classification;cluster analysis;Cluster analysis;geographic information system;Hierarchical cluster analysis;Hierarchical systems;traffic;Water management;AADT;Annual average daily traffic volume;Application programs;CRT;Distance-normalized traffic volume;DNTF;EDA;Exploratory data analysis;Geographic information systems;Geographic Information Systems;GIS;Industrial contaminants;Interpolation;kriging;Neural network;NN;prioritization;regression tree;resource availability;Spatial Analysis;Spatial interpolation method;TCW;Twin Cities Watershed;Urban water management;Watershed-to-lake area ratio;WLA;Sulfones,NA,NA
rayyan-735664986,River water contaminated with perfluorinated compounds potentially posing the greatest risk to young children,2013,2,1,Chemosphere,0045-6535,90,5,1617-1624,NA,https://research.ebsco.com/linkprocessor/plink?id=3678e5c7-4589-38a8-842f-9c4de367272e,eng,NA,NA,"Abstract: Although, humans are exposed to perflourinated compounds (PFCs) from various media, water consumption could be an important source for the residents living near to contaminated areas. Since comprehensive multimedia exposure model has not been developed for PFCs, assessment of the potential risk due to exposure to PFCs through direct water consumption could be a conservative estimate. The human health risks derived from the exposure to PFCs through water consumption were assessed for different age groups of general population in Taiwan using probabilistic approach. Based on available data on concentrations of PFCs in river water, exposure to PFOS, PFOA and PFDA via water consumption for different age groups were calculated using deterministic and probabilistic risk assessment methods. The oral non-cancer risks from PFOS, PFOA and their combination, expressed as a Hazard Index (HI), was determined by comparing oral exposure dose (through water intake) with the oral Reference Dose (RfD). The average exposure to PFOS, PFOA and PFDA via water consumption for adults ranged from 0.16 to 220.15, 0.43 to 12.5 and 0.43 to 2.36ngkg-bw<sup>−1</sup> d<sup>−1</sup> and for children 0.13–354.3, 0.35–20.17 and 0.35–3.79ngkg-bw<sup>−1</sup> d<sup>−1</sup>, respectively. Probabilistic values of total HIs for all age groups reside near to Keya River exceed the RfD 2.4–4.8 times, corresponding mainly to PFOS with a percentage of 97%. In conclusions, children aged 1–3years old and the residents reside near to Keya River are at the highest risk of exposure to PFCs via water consumption.",NA,10.1016/j.chemosphere.2012.08.039,Water pollution;Health risk assessment;Taiwan;Perfluoro compounds;European Food Safety Authority;Density functionals;Juvenile diseases;Probability theory;Water consumption;Only Child;Child,NA,NA
rayyan-735664020,Detection methods for sub-nanogram level of emerging pollutants – Per and polyfluoroalkyl substances,2022,NA,NA,Food and Chemical Toxicology,NA,168,NA,NA,NA,https://www.scopus.com/inward/record.uri?eid=2-s2.0-85137297676&doi=10.1016%2fj.fct.2022.113377&partnerID=40&md5=b608583aee8715074216692e2b816bdd,NA,NA,NA,"Per- and polyfluoroalkyl substances (PFAS) are organofluorine compounds has been manufactured for more than five decades and used in different purposes. Among persistent organic pollutants, PFAS are toxic, bioaccumulative in humans, wildlife, and global environment. As per environmental protection agency (EPA) guidelines, the perfluorooctanoate and perfluorooctane sulfonate permissible limit was 0.07 ng/L in drinking water. When the concentration exceeds the acceptable limit, it has negative consequences for humans. In such a case, PFAS monitoring is critical, and a quick detection technique are highly needed. Health departments and regulatory agencies have interests in monitoring of PFAS presences and exposures. For the detection of PFAS, numerous highly precise and sensitive chromatographic methods are available. However, the drawbacks of analytical techniques include timely sample preparations and the lack of on-site applicability. As a result, there is an increasing demand for simple sensor systems for monitoring of PFAS in real field samples. In this review, we first describe the sample pre-treatment and analytical techniques for the detection of PFAS. Second, we broadly discussed available sensor system for the quantification of PFAS in different filed samples. Finally, future trends in PFASs sensor are also presented. © 2022 Elsevier Ltd",NA,10.1016/j.fct.2022.113377,Fluorocarbons;Humans;PFASs;Chromatography;United States;fluorocarbon;Environmental Pollutants;Persistent Organic Pollutants;pollutant;toxicity;human;drinking water;Drinking Water;analysis;government;United States Environmental Protection Agency;Biosensor;Emerging pollutant;Nanomaterials;Smart sensor,NA,NA
rayyan-735663032,Detection of the plasmid-encoded fosfomycin resistance gene <i>fosA3</i> in <i>Escherichia coli</i> of food-animal origin,2013,1,1,JOURNAL OF ANTIMICROBIAL CHEMOTHERAPY,"[""0305-7453"", ""1460-2091""]",68,4,766-770,NA,NA,NA,NA,NA,"Objectives: To investigate the occurrence of plasmid-mediated fosfomycin resistance genes among Escherichia coli from food animals in China. Methods: A total of 892 E. coli isolates collected from individual pigs (n=368), chickens (n=196), ducks (n=261), geese (n=35), pigeons (n=20) and partridges (n=12) in Guangdong Province during 2002-08 were screened for the presence of fosA3, fosA and fosC2 by PCR amplification and sequencing. The clonal relationship of fosA3-positive isolates, plasmid content and other associated resistance genes were also characterized. Results: Twelve (1.3%) E. coli isolates showed resistance to fosfomycin and 10 (1.1%) isolates (4 from pigs, 2 from chickens, 2 from ducks, 1 from a goose and 1 from a pigeon) were positive for fosA3. None of the E. coli isolates was positive for fosA or fosC2. All of the isolates carrying fosA3 were CTX-M producers, and three of them carried rmtB. Most of the fosA3-harbouring isolates were found to be clonally unrelated. The fosA3 genes were flanked by IS26. Two fosA3 genes co-localized with rmtB and bla(CTX-M-65) on indistinguishable F33:A-:B- plasmids that carried three addiction systems (pemI/pemK, hok/mok/sok and srnB). Four, one and one fosA3 genes were found to be associated with IncN (ST8 type), Inch 1 and F2:A-:B- plasmids, respectively. Conclusions: We discovered that fosA3 is always associated with blo(CTX-M), which facilitates its quick dispersal. The emergence of fosA3 in food animals could impact on human medicine by the potential transfer of resistance through the food chain.",NA,10.1093/jac/dks465,Animal Shells;Animals;Escherichia coli;Fosfomycin,NA,NA
rayyan-735662717,Bioaccumulation and biomagnification of emerging poly- and perfluoroalkyl substances in marine organisms,NA,NA,NA,NA,NA,NA,NA,NA,NA,NA,NA,NA,NA,NA,NA,10.1016/j.scitotenv.2022.158117,"Messenger;Poly A-U;Poly I-C;Poly(A)-Binding Protein II;Poly(A)-Binding Proteins;Poly(ADP-ribose) Polymerases;Polyglactin 910;RNA;RNA, Messenger",NA,NA
rayyan-735663588,Practical Semiquantification Strategy for Estimating Suspect Per-and Polyfluoroalkyl Substance (PFAS) Concentrations,2023,5,3,JOURNAL OF THE AMERICAN SOCIETY FOR MASS SPECTROMETRY,"[""1044-0305"", ""1879-1123""]",34,5,939-947,NA,NA,NA,NA,NA,"Semiquantitation of suspect per-and polyfluoroalkyl substances (PFAS) in complex mixtures is challenging due to the increasing number of suspect PFAS. Traditional 1:1 matching strategies require selecting calibrants (target-surrogate standard pairs) based on head group, fluorinated chain length, and retention time, which is time-consuming and requires expert knowledge. Lack of uniformity in calibrant selection for estimating suspect concentrations among different laboratories makes comparing reported suspect concentrations difficult. In this study, a practical approach whereby the area counts for 50 anionic and 5 zwitterionic/cationic target PFAS were ratioed to the average area of their respective stable-isotope labeled surrogates to create ""average PFAS calibration curves"" for suspects detected in negative-and positive-ionization mode liquid chromatography quadrupole time-of-flight mass spectrometry. The calibration curves were fitted with log-log and weighted linear regression models. The two models were evaluated for their accuracy and prediction interval in predicting the target PFAS concentrations. The average PFAS calibration curves were then used to estimate the suspect PFAS concentration in a well-characterized aqueous film-forming foam. Weighted linear regression resulted in more target PFAS that fell within 70-130% of their known standard value and narrower prediction intervals than the log-log transformation approach. The summed suspect PFAS concentrations calculated by weighted linear regression and log-log transformation were within 8 and 16% of those estimated by a 1:1 matching strategy. The average PFAS calibration curve can be easily expanded and can be applied to any suspect PFAS even if the confidence in the suspect structure is low or unknown.",NA,10.1021/jasms.3c00019,character(0),NA,NA
rayyan-735663220,Changes in gene expression following long-term in vitro exposure of <i>Macaca mulatta</i> trophoblast stem cells to biologically relevant levels of endocrine disruptors,2018,1,1,REPRODUCTIVE TOXICOLOGY,0890-6238,77,NA,154-165,NA,NA,NA,NA,NA,"Trophoblast stem cells (TSCs) are crucial for embryo implantation and placentation. Environmental toxicants that compromise TSC function could impact fetal viability, pregnancy, and progeny health. Understanding the effects of low, chronic EDC exposures on TSCs and pregnancy is a priority in developmental toxicology. Differences in early implantation between primates and other mammals make a nonhuman primate model ideal. We examined effects of chronic low-level exposure to atrazine, tributyltin, bisphenol A, bis(2-ethylhexyl) phthalate, and perfluorooctanoic acid on rhesus monkey TSCs in vitro by RNA sequencing. Pathway analysis of affected genes revealed negative effects on cytokine signaling related to anti-viral response, most strongly for atrazine and tributyltin, but shared with the other three EDCs. Other affected processes included metabolism, DNA repair, and cell migration. Low-level chronic exposure of primate TSCs to EDCs may thus compromise trophoblast development in vivo, inhibit responses to infection, and negatively affect embryo implantation and pregnancy. (C) 2018 Elsevier Inc. All rights reserved.",NA,10.1016/j.reprotox.2018.02.012,Gene Expression;Macaca mulatta,NA,NA
rayyan-735663803,"Per- and Polyfluoroalkyl Substances: Impacts on Morphology, Behavior and Lipid Levels in Zebrafish Embryos",2024,NA,NA,Toxics,NA,12,3,NA,NA,https://www.scopus.com/inward/record.uri?eid=2-s2.0-85188880645&doi=10.3390%2ftoxics12030192&partnerID=40&md5=d3e8f303d6ad3ef2674cd25dafb96493,NA,NA,NA,"The presence of per- and polyfluoroalkyl substances (PFASs) in aquatic environments is often persistent and widespread. Understanding the potential adverse effects from this group of chemicals on aquatic communities allows for better hazard characterization. This study examines impacts on zebrafish (Danio rerio) embryo physiology, behavior, and lipid levels from exposure to perfluorooctanoic acid (PFOA), perfluorohexane sulfonate (PFHxS), and heptadecafluorooctanesulfonic acid (PFOS). Embryos were exposed to lethal and sublethal levels of each chemical and monitored for alterations in physiological malformations, mortality, lipid levels, and behavior (only PFOA and PFHxS). The predicted 50% lethal concentrations for 120 hpf embryos were 528.6 ppm PFOA, 14.28 ppm PFHxS, and 2.14 ppm PFOS. Spine curvature and the inability of the 120 hpf embryos to maintain a dorsal-up orientation was significantly increased at 10.2 ppm PFHxS and 1.9 ppm PFOS exposure. All measured 120 hpf embryo behaviors were significantly altered starting at the lowest levels tested, 188 ppm PFOA and 6.4 ppm PFHxS. Lipid levels decreased at the highest PFAS levels tested (375 PFOA ppm, 14.4 PFHxS ppm, 2.42 ppm PFOS). In general, the PFAS chemicals, at the levels examined in this study, increased morphological deformities, embryo activity, and startle response time, as well as decreased lipid levels in 120 hpf zebrafish embryos. © 2024 by the authors.",NA,10.3390/toxics12030192,PFAS;PFOS;PFOA;lipidomics;behavior;PFHxS;zebrafish;lipids,NA,NA
rayyan-735664920,Current status of indoor dust PBDE pollution and its physical burden and health effects on children.,2023,NA,NA,Environmental science and pollution research international,NA,30,8,19642-19661,NA,https://login.wwwproxy1.library.unsw.edu.au/login?url=https://www.proquest.com/scholarly-journals/current-status-indoor-dust-pbde-pollution/docview/2766432344/se-2?accountid=12763,English,NA,NA,"Polybrominated diphenyl ethers (PBDEs) are widely detected in indoor dust, which has been identified as a more important route of PBDE exposure for children than food intake. The physical burden and health hazards to children of PBDE exposure in house dust have not been adequately summarized; therefore, this article reviews the current status of PBDE pollution in indoor dust associated with children, highlighting the epidemiological evidence for physical burden and health risks in children. We find that PBDEs remain at high levels in indoor dust, including in homes, schools, and cars, especially in cars showing a significant upward trend. There is a trend towards an increase in the proportion of BDE-209 in household dust, which is indicative of recent PBDE contamination. Conversely, PBDE congeners in car and school indoor dust tended to shift from highly brominated to low brominated, suggesting a shift in current pollution patterns. Indoor dust exposure causes significantly higher PBDE burdens in children, especially infants in early life, than in adults. Exposure to dust also affects breast milk, putting infants at high risk of exposure. Although evidence is limited, available epidemiological studies suggest that exposure to indoor dust PBDEs promotes neurobehavioral problems and cancer development in children.",NA,10.1007/s11356-022-24723-w,Female;Humans;Environmental Monitoring;Environmental Exposure;Halogenated Diphenyl Ethers;Infant;Child;Only Child;Dust;Adult;Body burden;analysis;PBDE;Health;pentabromodiphenyl ether;Children;Air Pollution;Indoor;0;Index Medicus;7REL09ZX35,NA,NA
rayyan-735663800,"Partitioning of PFAS to serum, tissues, eggs, and hatchlings of an Australian freshwater turtle",2024,NA,NA,Journal of Hazardous Materials,NA,469,NA,NA,NA,https://www.scopus.com/inward/record.uri?eid=2-s2.0-85187691759&doi=10.1016%2fj.jhazmat.2024.133885&partnerID=40&md5=4b23f7f823616185cc7d06faae185dec,NA,NA,NA,"Turtles are a potential sentinel species of aquatic ecosystem health as they inhabit aquatic ecosystems, are long lived, and potentially have high exposure to anthropogenic chemicals via food and water. This study investigated per- and polyfluoroalkyl substances (PFAS) tissue partitioning in female Emydura macquarii macquarii turtle, and the maternal offloading of (PFAS) into eggs and then hatchlings as well as the accumulation of PFAS in male and female Emydura macquarii macquarii serum. Significantly higher levels of perfluorosulfonic acids (PFSAs) and perfluorocarboxylic acids (PFCAs) were measured in the male serum compared to the female turtle serum, whereas perfluoroalkane sulfonamides (FASAs) were significantly higher in the female turtle serum. Perfluorooctane sulfonate (PFOS) was the predominant PFAS in the turtles whereas PFHxA was the predominant PFAS found in the surrounding water. PFHxA was not reported in any turtle tissue or the serum. The short-chain PFSAs and FASAs appeared to be highly associated with blood; long-chain PFSAs and PFCAs were more likely to be associated with tissue. Half of the PFHxS and all the long-chain PFSAs and PFCAs reported in the yolks were transferred into the hatchlings (by mass), suggesting a potential intergenerational effect. © 2024",NA,10.1016/j.jhazmat.2024.133885,PFAS;Eggs;Sulfur compounds;Amides;bioaccumulation;chemical substance;Polyfluoroalkyl substances;Histology;egg;Tissue;serum;Maternal transfer;turtle;freshwater ecosystem;physiology;Chemical contamination;aquatic ecosystem;Serum;Egg;Water;Fresh Water;Perfluorosulfonic acid;Aquatic ecosystems;partitioning;FASA;FASAs;Freshwater turtle;Freshwater turtles;Hatchling;Hatchlings;Partitioning;Tissues;Ovum,NA,NA
rayyan-735664312,Levels of persistent organic pollutants (POPs) in foods from the first regional Sub-Saharan Africa Total Diet Study,2020,NA,NA,Environment International,NA,135,NA,NA,NA,https://www.scopus.com/inward/record.uri?eid=2-s2.0-85076833153&doi=10.1016%2fj.envint.2019.105413&partnerID=40&md5=1ad31dd660147e9e7116072325fee35d,NA,NA,NA,"For the first time, a multi-centre Total Diet Study was carried out in Benin, Cameroon, Mali and Nigeria. We collected and prepared as consumed 528 typical fatty foods from those areas and pooled these subsamples into 44 composites samples. These core foods were tested for a wide spectrum of POPs, including polychlorinated dibenzo-p-dioxins (PCDDs), polychlorinated dibenzofurans (PCDFs), polychlorinated biphenyls (PCBs), brominated flame-retardants (BFRs), organochlorine compounds (OCs), perfluoro alkyl substances (PFAS) and chlorinated flame retardants (CFRs). The POPs contamination levels were similar or lower than those reported in total diet studies previously conducted worldwide. In most cases, core foods belonging to fish food group presented higher POPs concentrations than the other food groups. Interestingly, we observed a difference in both contamination profile and concentration for smoked fish compared to non-smoked fish. Such finding suggests that the smoking process itself might account for a large proportion of the contamination. Further investigation would require the assessment of combustion materials used to smoke fish as a potential vehicle, which may contribute to the dietary exposure of the studied populations to POPs. © 2019 Food and Agriculture Organization of the United Nations",NA,10.1016/j.envint.2019.105413,PFAS;Fish;Persistent organic pollutants;Animals;Article;animal;concentration (parameter);nonhuman;unclassified drug;food contamination;Organic pollutants;organochlorine derivative;polychlorinated biphenyl;Environmental Pollutants;persistent organic pollutant;pollutant;food;Chlorine compounds;diet;concentration (composition);flame retardant;Flame retardants;Flame Retardants;Meats;PCB;Polychlorinated biphenyls;Polychlorinated Biphenyls;Contamination;priority journal;Diet;Polychlorinated biphenyl (PCBs);Chemical contamination;organic compound;food analysis;PCDF;polychlorinated dibenzodioxin;polychlorinated dibenzofuran;Polychlorinated dibenzofurans;Nigeria;PCDD;combustion;Polychlorinated dibenzo p dioxin (PCDDs);Brominated flame retardants (BFRs);Dibenzofurans;chlorine derivative;PCDD/F;food composition;Smoke;Food contamination;Polychlorinated;Africa South of the Sahara;Benin [West Africa];Africa south of the Sahara;Cameroon;fatty food;fish product;Food contamination data;Mali;non smoked fish;perfluoro alkyl substance derivative;smoked fish;Sub-Saharan Africa,NA,NA
