key,title,year,month,day,journal,issn,volume,issue,pages,authors,url,language,publisher,location,abstract,notes,doi,keywords,pubmed_id,pmc_id
rayyan-735663880,Perfluoroalkyl acid depuration from the edible tissues of a migratory recreationally fished species,2023,NA,NA,Marine Pollution Bulletin,NA,196,NA,NA,NA,https://www.scopus.com/inward/record.uri?eid=2-s2.0-85173185015&doi=10.1016%2fj.marpolbul.2023.115593&partnerID=40&md5=d1f527837997222dac2292f557436904,NA,NA,NA,"Environmental emissions of perfluoroalkyl acids (PFAAs) impact estuarine species and the fisheries that rely on them. Migratory estuarine fishes may be captured for consumption in areas distant to known contaminant sources, but exposure risk depends on how quickly contaminants are depurated. This baseline presents the outcomes from a novel experiment simulating the migration of a popular recreational fish species (Dusky Flathead, Platycephalus fuscus) following environmental exposure to PFAAs, and assessing depuration from edible muscle tissues. Over the 33-day experiment, perfluorooctane sulfonate (PFOS) concentrations declined slowly, with modelling suggesting that concentrations fell below the relevant screening value (5.2 μg kg−1) within ∼558 h (285–1372 h; 90 % CI). Low concentrations (<1.2 μg kg−1) of perfluorohexane sulfonate also depurated rapidly. This study provides useful information for assessing potential exposure risk posed by recreationally targeted fish migrating away from contaminated areas. The experimental design employed has a real-world context that is relevant for future studies. © 2023",NA,10.1016/j.marpolbul.2023.115593,PFAS;Perfluoroalkyl acids;Fish;Alkanesulfonic Acids;Fluorocarbons;Animals;Article;Perfluorooctane sulfonates;Environmental Exposure;animal;concentration (parameter);environmental exposure;fluorocarbon;nonhuman;bioaccumulation;chemistry;water pollutant;Histology;perfluorooctanesulfonic acid;pollution exposure;alkanesulfonic acid;perfluorohexanesulfonic acid;Risk assessment;Tissue;migratory species;muscle;muscle tissue;Perfluorooctane sulfonate;water contamination;depuration;Fisheries;fishery;risk factor;Depuration;Muscles;polymer;experimental design;marine pollution;Alkanesulfonates;Water Pollutants;Chemical;Migration;Sulphonates;Edible tissue;Exposure risk;fishing;migratory fish;Perfluorohexane sulfonate;Perfluorohexane sulphonate;Platycephalus fuscus;recreational activity;Recreational fisheries,NA,NA
rayyan-735663574,"SYNTHESIS OF <SUP>15</SUP>N-ENRICHED UREA (CO(<SUP>15</SUP>NH<sub>2</sub>)<sub>2</sub>) FROM <SUP>15</SUP>NH<sub>3</sub>, CO, AND S IN A DISCONTINUOUS PROCESS",2012,NA,NA,BRAZILIAN JOURNAL OF CHEMICAL ENGINEERING,"[""0104-6632"", ""1678-4383""]",29,4,795-806,NA,NA,NA,NA,NA,"CO((NH2)-N-15)(2) enriched with the stable isotope N-15 was synthesized based on a reaction involving CO, (NH3)-N-15, and S in the presence of CH3OH. The method differs from the industrial method; a stainless steel reactor internally lined with polytetrafluoroethylene (PTFE) was used in a discontinuous process under low pressure and temperature. The yield of the synthesis was evaluated as a function of the parameters: the amount of reagents, reaction time, addition of H2S, liquid solution and reaction temperature. The results showed that under optimum conditions (1.36, 4.01, and 4.48 g of (NH3)-N-15, CO, and S, respectively, 40 ml CH3OH, 40 mg H2S, 100 degrees C and 120 min of reaction) 1.82 g (yield 76.5%) of the compound was obtained per batch. The synthesized CO((NH2)-N-15)(2) contained 46.2% N, 0.55% biuret, melting point of 132.55 degrees C and did not exhibit isotopic fractionation. The production cost of CO((NH2)-N-15)(2) with 90.0 at. % N-15 was US$ 238.60 per gram.",NA,10.1590/S0104-66322012000400011,character(0),NA,NA
rayyan-735663612,Environmental specimen banks and the European Green Deal,2022,12,15,SCIENCE OF THE TOTAL ENVIRONMENT,"[""0048-9697"", ""1879-1026""]",852,NA,NA,NA,NA,NA,NA,NA,"The study highlights the potential of Environmental Specimen Banks (ESBs) for implementing the Zero Pollution Am-bition and the Biodiversity Strategy of the European Green Deal. By drawing on recent monitoring studies of European ESBs, we illustrate the role ESBs already play in assessing the state of ecosystems in Europe and how they help to make developments over time visible. The studies reveal the ubiquitous presence of per- and polyfluoroalkyl substances, ha-logenated flame retardants, chlorinated paraffns, plasticizers, cyclic volatile methyl siloxanes, UV-flters, pharmaceu-ticals, and microplastics in the European environment. Temporal trends demonstrate the effectiveness of European regulations on perfluorooctane sulfonic acid, pentabrominated diphenylethers and diethylhexyl phthalate, but also point to the rise of substitutes such as non-phthalate plasticizers and short-chain perfluoroalkyl substances. Other stud-ies are wake-up calls indicating the emergence of currently unregulated compounds such as long-chain chlorinated paraffns. Ecological studies show temporal trends in biometric parameters and stable isotope signatures that suggest long-term changes in environmental conditions. Studies on biodiversity of ecosystems using environmental DNA are still in their beginnings, but here too there is evidence of shifts in community composition that can be linked to chang-ing environmental conditions. This review demonstrates the value of ESBs (a) for describing the status of the environ-ment, (b) for monitoring temporal changes in environmental pollution and the ecologic condition of ecosystems and thereby (c) for supporting regulators in prioritizing their actions towards the objectives of the Green Deal.",NA,10.1016/j.scitotenv.2022.158430,character(0),NA,NA
rayyan-735663172,Spatial trends of perfluoroalkyl compounds in ringed seals (<i>Phoca hispida</i>) from the Canadian Arctic,2008,1,1,ENVIRONMENTAL TOXICOLOGY AND CHEMISTRY,"[""0730-7268"", ""1552-8618""]",27,3,542-553,NA,NA,NA,NA,NA,"The present study examined spatial trends of perfluoroalkyl compounds (PFCs) in liver samples from 11 populations of ringed seals (Phoca hispida) in the Canadian Arctic from 2002 to 2005. Trophic position and relative carbon sources were compared by analyzing stable nitrogen and carbon isotopes in muscle samples. Geometric mean concentrations of total C-9-C-15 perfluorinated carboxylates (PFCAs) ranged from 8.8 to 84 ng/g wet weight, and C-9-C-11 PFCAs predominated. Perfluorooctane sulfonate was the dominant PFC measured, with concentrations ranging from 6.5 to 89 ng/g wet weight, contributing between 29 and 56% of the total PFC concentration. Overall, mean PFC concentrations were similar between populations, and differences were attributed largely to elevated levels in the Gjoa Haven (Rae Strait, central Canadian Arctic archipelago) and Inukjuak populations (eastern Hudson Bay) and to lower concentrations at Pangnirtung (Cumberland Sound, Baffin Island). Mean stable nitrogen isotope ratios (+/- 95% confidence intervals) ranged from 14.7 parts per thousand (+/- 0.3 parts per thousand) at Nain (Labrador) to 17.9 parts per thousand (+/- 0.7 parts per thousand) at Gjoa Haven, suggesting that all populations were within the same trophic level. Stable carbon isotope ratios varied widely between the seal populations, ranging from -22.9 parts per thousand (+/- 0.2 parts per thousand) at Gjoa Haven to -17.7 parts per thousand (+/- 0.4 parts per thousand) at Nain. The delta C-13 ratios from Gjoa Haven were significantly more depleted than those for other populations and may suggest a terrestrially based carbon source. The depleted stable carbon isotope ratio may explain the elevated PFC concentrations in the Gjoa Haven population. Analysis of covariance indicated that delta C-13 was a significant covariable for seven of nine seal populations for which delta C-13 values were available. After adjusting for delta C-13 values. concentrations of most PFCs generally were statistically greater in the Grise Fiord, Qikiqtarjuaq, Arviat, and Nain populations.",NA,10.1897/07-428.1,character(0),NA,NA
rayyan-735663984,Spatiotemporal and life history related trends of per- and polyfluoroalkyl substances in Indo-Pacific finless porpoises from south China sea (2007–2020),2023,NA,NA,Chemosphere,NA,310,NA,NA,NA,https://www.scopus.com/inward/record.uri?eid=2-s2.0-85140274219&doi=10.1016%2fj.chemosphere.2022.136780&partnerID=40&md5=6793eecdd0b2d981bee327bed64d2192,NA,NA,NA,"Per- and polyfluoroalkyl substances (PFASs) levels in Indo-Pacific finless porpoises (Neophocaena phocaenoides) in the Pearl River Estuary (PRE), near the most economically developed region in China, have not been characterized. We measured the hepatic concentrations of twelve PFASs, including nine perfluoroalkyl carboxylic acids (PFCAs) and three perfluoroalkane sulfonic acids (PFSAs) in the finless porpoises (n = 21) collected from the PRE between 2007 and 2020. The average level of PFSAs was more than 2-times higher than that of PFCAs. The order of six dominant PFASs was perfluorooctane sulfonate (PFOS) > perfluoroundecanoic acid (PFUdA) > perfluorodecanoic acid (PFDA) > perfluorotridecanoic acid (PFTrDA) > perfluorononanoic acid (PFNA) > perfluorododecanoic acid (PFDoDA). The levels of Hepatic PFOS of 29% samples exceeded the no observable adverse effect level (NOAEL) values. The concentration of PFASs in males was significant higher than in females. PFASs levels were significantly negatively correlated with body length in males and positively correlated in females. PFASs levels in the PRE finless porpoises were lower than in humpback dolphins possibly due to different foraging habitat toward the coast and the consumption of less fish. PFCAs levels in finless porpoises from the western PRE were higher compared to Hong Kong, possibly due to the high-intensity sources of terrestrial anthropogenic pollutants. Significant increasing spatiotemporal trends of PFSAs, PFCAs and PFASs were found in finless porpoises from 2007 to 2020, suggesting a continuously increased risk of PFASs exposure for PRE cetaceans in the last decade. © 2022 Elsevier Ltd",NA,10.1016/j.chemosphere.2022.136780,Alkanesulfonic Acids;Female;Fluorocarbons;Animals;Article;Environmental Monitoring;Spatiotemporal trends;Carboxylic Acids;Sulfonic Acids;China;animal;concentration (parameter);female;fluorocarbon;male;Male;nonhuman;unclassified drug;controlled study;environmental monitoring;alkyl group;perfluoroalkanoic acid;Polyfluoroalkyl substances;water pollutant;Mammals;perfluorodecanoic acid;perfluorododecanoic acid;perfluorooctanesulfonic acid;perfluorooctanoic acid;perfluorotridecanoic acid;perfluoroundecanoic acid;spatiotemporal analysis;alkanesulfonic acid;no-observed-adverse-effect level;perfluorohexanesulfonic acid;Risk assessment;Risks assessments;sulfonate;sulfonic acid derivative;carboxylic acid;polyfluoroalkyl substance;perfluorononanoic acid;perfluorotetradecanoic acid;limit of detection;estuary;Perfluoroalkyl carboxylic acids;metabolic capacity;perfluorohexadecanoic acid;alkanesulfonic acid derivative;Hong Kong;life history;Water Pollutants;body height;Chemical;sex;Per-;polyfluoroalkyl substances;per-;Sulphonic acids;Dolphins;toothed whale;Perfluoroalkanes;South China Sea;South China sea;Finless porpoise;Finless porpoises;Neophocaena;Neophocaena phocaenoides;Pearl River [United States];Pearl River estuary;porpoise;Porpoises;Zhujiang Estuary,NA,NA
rayyan-735664086,Bioaccumulation and metabolic response of PFAS mixtures in wild-caught freshwater turtles (Emydura macquarii macquarii) using omics-based ecosurveillance techniques,2022,NA,NA,Science of the Total Environment,NA,806,NA,NA,NA,https://www.scopus.com/inward/record.uri?eid=2-s2.0-85118254538&doi=10.1016%2fj.scitotenv.2021.151264&partnerID=40&md5=8b620f678e67782c085409574042617f,NA,NA,NA,"PFAS mixtures in the environment are common and identifying PFAS constituents, bioaccumulation, and biological impacts of mixtures remains a challenge. Here, an omics-based ecosurveillance approach was taken to investigate the impacts of PFAS pollution in freshwater turtles (Emydura macquarii macquarii). Four turtles were collected from an impacted waterway downstream from an industrial source of PFAS contamination in Queensland, Australia and analysed for 49 different PFAS. One turtle was collected from a suitable control site. PFAS concentrations were quantified in turtle serum using an established targeted methodology. The serum PFAS concentration was ten-fold greater at the impacted site (Σ49 PFAS 1933 ± 481 ng/mL) relative to the control sample (Σ49 PFAS 140 ng/mL). Perfluorooctane sulfonate (PFOS; 889 ± 56 ng/mL) was 235 times higher in turtle serum than in the water that they were collected from (ΣPFAS 32.0 μg/L). Perfluorobutane sulfonamide (FBSA; 403 ± 83 ng/mL) and perfluorohexane sulfonamide (FHxSA; 550 ± 330 ng/mL) were also reported at substantial concentrations in the serum of impacted turtles. Biochemical profiles were analysed using a mixture of liquid chromatography triple quadrupole (QqQ) and quadrupole time-of-flight (QToF) mass spectrometry methodologies. These profiles demonstrated a positive correlation in the impacted turtles exposed to elevated PFAS with an enhanced purine metabolism, glycerophosphocholines and an innate immune response, which suggest an inflammation response, metabolic preservation and re-routing of central carbon metabolites. Conversely, lipid transport and binding activity were negatively correlated. Using these preliminary data, we were able to demonstrate the negative metabolic impact from PFAS mixtures on turtle metabolic health. With further research on a larger turtle cohort, omics-based data will contribute towards linking adverse outcome pathways for turtle populations exposed to PFAS mixtures. Moreover, expanding the use of ecosurveillance tools will inform mechanistic toxicological data for risk assessment and regulatory applications. © 2021",NA,10.1016/j.scitotenv.2021.151264,Biochemistry;PFAS;Alkanesulfonic Acids;Fluorocarbons;PFOS;Animals;Sulfur compounds;Bioaccumulation;animal;fluorocarbon;Mixtures;bioaccumulation;water pollutant;Liquid chromatography;Mass spectrometry;alkanesulfonic acid;Risk assessment;turtle;Turtles;Metabolism;Metabolites;Population statistics;Lipidomics;fresh water;Water;Metabolomics;Fresh Water;Water Pollutants;Proteomics;Chemical;Environmental exposure;Molecular biology;'omics';Multi-omic;Multi-omics;Ecosurveillance;Metabolic health,NA,NA
rayyan-735663117,"Perfluorinated contaminants in sediments and aquatic organisms collected from shallow water and tidal flat areas of the Ariake Sea, Japan: environmental fate of perfluorooctane sulfonate in aquatic ecosystems",NA,NA,NA,NA,NA,NA,NA,NA,NA,NA,NA,NA,NA,NA,NA,10.1021/es0603195,Japan;Sulfones,NA,NA
rayyan-735664484,"Occurrence and incidence of 18 per- and polyfluoroalkyl compounds in edible oils commonly consumed in Guiyang, China",2017,NA,NA,"Food Additives and Contaminants - Part A Chemistry, Analysis, Control, Exposure and Risk Assessment",NA,34,9,1573-1583,NA,https://www.scopus.com/inward/record.uri?eid=2-s2.0-85021433473&doi=10.1080%2f19440049.2017.1339330&partnerID=40&md5=24c1af9bec0aa609a3f8cc384b889416,NA,NA,NA,"A systematic examination was conducted for the first time of a wide carbon-chain range of per- and polyfluoroalkyl compounds (PFASs) in 83 samples of edible vegetable and animal oils from Guiyang, China. The occurrence and levels of 18 PFASs in seven types of edible oil were analysed. Analytes were determined based on a simplified, sensitive and reliable solvent extraction and liquid chromatography-tandem mass spectrometry method. Ten target PFASs were found and the most frequently detected compounds with maximum concentration were PFOS (88%, 1.93 ng g–1), PFNA (55.4%; 6.76 ng g–1), PFHxS (39.8%; 0.36 ng g–1), and PFOA (16.9%; 0.15 ng g–1), respectively. The total PFASs concentrations ranged from 0.02 to 6.76 ng g–1, with a mean of 0.94 ng g–1. Significant differences of occurrence between vegetable oils and animal oils were demonstrated based on comparative analysis of the existing data. The investigation results showed that the effect of production reductions of PFOS and PFOA by regulatory was also reflected in edible oils. The dietary intakes of PFOS and PFOA for adults were estimated, which were lower than the available tolerable daily intake (TDI). Because of the global lack of food regulatory thresholds for most per- or polyfluoroalkyl compounds, it was difficult to draw any conclusion at this stage as to how human health is affected through exposure to these compounds. The baseline information of this study will assist in guiding the direction for future investigations and monitoring studies on occurrence, fate and human health-effect research of PFASs. © 2017 Informa UK Limited, trading as Taylor & Francis Group.",NA,10.1080/19440049.2017.1339330,Alkanesulfonic Acids;Fluorocarbons;Humans;Liquid chromatography-tandem mass spectrometry;Animals;Article;Food Contamination;China;animal;fluorocarbon;unclassified drug;Carbon;controlled study;dietary intake;food contamination;alkyl group;chemistry;Human exposures;Liquid chromatography;Mass spectrometry;liquid chromatography-mass spectrometry;adult;alkanesulfonic acid;Solvent extraction;risk assessment;Risk assessment;human;priority journal;food intake;solvent extraction;sensitivity analysis;analysis;Polyfluoroalkyl compounds;incidence;Incidence;Tolerable daily intake;fats;Oils;per-;Occurrence;Maximum concentrations;human exposure;reduction (chemistry);edible oil;Plant Oils;polyfluoroalkyl compound;polyfluoroalkyl compounds;Production reduction;Regulatory thresholds;vegetable oil,NA,NA
rayyan-735663364,"Phosphorus-Containing Fluorinated Organics: Polyfluoroalkyl Phosphoric Acid Diesters (diPAPs), Perfluorophosphonates (PFPAs), and Perfluorophosphinates (PFPIAs) in Residential Indoor Dust",2012,11,20,ENVIRONMENTAL SCIENCE & TECHNOLOGY,0013-936X,46,22,12575-12582,NA,NA,NA,NA,NA,"Indoor dust is thought to be a source of human exposure to perfluorocarboxylates (PFCAs) and perfluorosulfonates (PFSAs), but exposures to emerging organofluorine compounds, including precursors to PFCAs and PFSAs via indoor dust, remain unknown. We report an analytical method for measuring several groups of emerging phosphorus-containing fluorinated compounds, including polyfluoroalkyl phosphoric acid diesters (diPAP), perfluorophosphonates (PFPA), and perfluorophosphinates (PFPIA), as well as perfluoroethylcyclohexane sulfonate (PFECHS) in indoor dust. This method was used to analyze diPAP, PFPA, and PFPIA levels in 102 residential dust samples collected in 2007-2008 from Vancouver, Canada. The results indicated a predominant and ubiquitous presence of diPAPs (frequency of detection 100%, mean and median Sigma diPAPs 7637 and 2215 ng/g). Previously measured median concentrations of perfluorooctane sulfonate (PFOS), perfluorooctanoate (PFOA), and fluorotelomer alcohols (FTOHs) in the same samples were 14-74 times lower than Sigma diPAP levels, i.e. 71 ng/g PFOS, 30 ng/g PFOA, and 152 ng/g Sigma FTOHs. PFPAs and PFPIAs were detected in 62% and 85% of samples, respectively, at concentrations nearly 3 orders of magnitude lower than diPAPs (median 2.3 ng/g Sigma PFPAs and 2.3 ng/g Sigma PFPIAs). PFECHS was detected in only 8% of dust samples. To the best of our knowledge, this is the first report of these compounds in indoor dust. In this study, diPAP concentrations represented 98% +/- 7% of the total measured analytes in the dust samples. Detection of diPAPs at such high concentrations in indoor dust may represent an important and as-yet unrecognized indirect source of PFCA exposure in humans, given the identified biotransformation pathways. Identifying the sources of diPAPs to the indoor environment is a priority for future research to improve air quality in households.",NA,10.1021/es303172p,Dust;Phosphorus,NA,NA
rayyan-735665030,Characterisation of PFASs and Organofluorine in Freshwater Environments : Transfer from water to land via emergent aquatic insects,2020,NA,NA,NA,NA,NA,NA,NA,NA,http://urn.kb.se/resolve?urn=urn:nbn:se:oru:diva-82801,eng,NA,NA,"Per- and polyfluoroalkyl substances (PFASs) are anthropogenic contaminants of emerging concern, because many are highly persistent to degradation and have been linked to adverse effects in humans as well as their ubiquitous spread in aquatic environments. This thesis investigated distribution of PFASs and organofluorine in freshwater environments impacted by PFAS point sources. The main focus was to study potential transfer of PFASs from freshwater systems to riparian zones via emergent aquatic insects as well as potential impacts on riparian invertebrate consumers. Comprehensive sets of samples, such as aquatic insect larvae, emergent aquatic insects, terrestrial invertebrate consumers and water were collected from mainly two sites in Sweden, Ronneby Airport and Kvarntorp industrial area. Homologue and branched isomer profiles, estimates of mass discharges, bioaccumulation factors, stable isotope analysis of carbon and nitrogen as well as organofluorine mass balance and suspect screening analysis were used to characterize the distribution of PFASs in these freshwater environments including their aquatic and terrestrial invertebrate food webs. Results revealed elevated PFAS concentrations in emergent aquatic insects and riparian invertebrate consumers, especially in spiders. Calculated biodriven transfers indicated that impact on riparian insectivores could be substantial on a local and seasonal scale. Furthermore, PFAS concentrations in terrestrial consumers were related to aquatic-based diet and trophic levels, indicating that biomagnification was a major pathway of uptake for some PFASs. Organofluorine mass balance could be closed for most aquatic and for some terrestrial invertebrates from the Ronneby site by target PFAS analysis, whereas a fraction of 50% in surface water was unidentified organofluorine. Most new PFASs, tentatively identified by suspect screening, were found in water samples and given that contamination occurred decades ago suggested that those PFASs, mainly perfluoroalkyl ...",NA,NA,Annan kemi;Other Chemistry Topics;PFASs;AFFF;riparian zone;emergent aquatic insects;organofluorine mass balance;point sources;stable isotopes;terrestrial consumers,NA,NA
