key,title,year,month,day,journal,issn,volume,issue,pages,authors,url,language,publisher,location,abstract,notes,doi,keywords,pubmed_id,pmc_id
rayyan-735663920,Elevated Levels of Ultrashort- and Short-Chain Perfluoroalkyl Acids in US Homes and People,2023,NA,NA,Environmental Science and Technology,NA,57,42,15782-15793,NA,https://www.scopus.com/inward/record.uri?eid=2-s2.0-85175357433&doi=10.1021%2facs.est.2c06715&partnerID=40&md5=f214e74cbb787c6cbb427292c4830161,NA,NA,NA,"Per- and polyfluoroalkyl substances (PFAS) make up a large group of fluorinated organic compounds extensively used in consumer products and industrial applications. Perfluorooctanesulfonic acid (PFOS) and perfluorooctanoic acid (PFOA), the two perfluoroalkyl acids (PFAAs) with 8 carbons in their structure, have been phased out on a global scale because of their high environmental persistence and toxicity. As a result, shorter-chain PFAAs with less than 8 carbons in their structure are being used as their replacements and are now widely detected in the environment, raising concerns about their effects on human health. In this study, 47 PFAAs and their precursors were measured in paired samples of dust and drinking water collected from residential homes in Indiana, United States, and in blood and urine samples collected from the residents of these homes. Ultrashort- (with 2 or 3 carbons [C2-C3]) and short-chain (with 4-7 carbons [C4-C7]) PFAAs were the most abundant in all four matrices and constituted on average 69-100% of the total PFAA concentrations. Specifically, trifluoroacetic acid (TFA, C2) and perfluoropropanoic acid (PFPrA, C3) were the predominant PFAAs in most of the samples. Significant positive correlations (n = 81; r = 0.23-0.42; p < 0.05) were found between TFA, perfluorobutanoic acid (PFBA, C4), and perfluoroheptanoic acid (PFHpA, C7) concentrations in dust or water and those in serum, suggesting dust ingestion and/or drinking water consumption as important exposure pathways for these compounds. This study demonstrates that ultrashort- and short-chain PFAAs are now abundant in the indoor environment and in humans and warrants further research on potential adverse health effects of these exposures. © 2023 The Authors. Published by American Chemical Society.",NA,10.1021/acs.est.2c06715,PFAS;Biomonitoring;Perfluoroalkyl acids;Alkanesulfonic Acids;Fluorocarbons;Humans;exposure;PFAAs;chemical pollutant;Article;United States;Dust;concentration (parameter);female;fluorocarbon;male;perfluoroalkyl acid;unclassified drug;biomonitoring;chemical substance;chemistry;Polyfluoroalkyl substances;water pollutant;chemical compound;pollution exposure;adult;alkanesulfonic acid;perfluorooctane sulfonamide;human;urine;middle aged;carboxylic acid;blood sampling;drinking water;Potable water;perfluoroheptanoic acid;perfluorobutanoic acid;perfluorocarboxylic acid;Drinking Water;fluorotelomer alcohol;body burden;Consumer products;health impact;dust;persistence;precursor;trifluoroacetic acid;Shorter chains;Water Pollutants;Chemical;Indoor exposure;ingestion;urine sampling;housing;Indiana;ultrashort-chain PFAS;Ultrashort-chain polyfluoroalkyl substance;Acid precursors;Perfluoroalkyl acid precursor;perfluoropropionic acid;fluid intake;fluorotelomer acrylate;fluorotelomer methacrylate;fluorotelomer sulfonate;indoor exposure;perfluoroalkanesulfonic acid;perfluorooctane sulfonamidoethanol;perfluoropropanoic acid;Perfluoropropanoic acid;perfluoropropanoic acid (PFPrA);PFAA precursors;polyfluorinated phosphate ester;population parameters;residential home;short-chain PFAS;Short-chain polyfluoroalkyl substance;Trifluoroacetic acid;trifluoroacetic acid (TFA),NA,NA
rayyan-735663454,Raman Spectroscopy and Machine Learning for Microplastics Identification and Classification in Water Environments,2023,NA,NA,IEEE JOURNAL OF SELECTED TOPICS IN QUANTUM ELECTRONICS,"[""1077-260X"", ""1558-4542""]",29,4,NA,NA,NA,NA,NA,NA,"As emerging pollutants of concern, microplastics (MPs) have been found in different water environments and have an impact on human health through the aquatic food chain. To advance our understanding of the traceability and environmental fate of MPs, reproducible and accurate methods, techniques, and analytical methods are necessary for MP type identification and characterization. In this study, based on Raman spectroscopy technology to extract characteristic peak information of MPs with fingerprint features, coupled to sparse autoencoder (SAE) and soft-max classifier framework, the rapid identification and classification of six common MP (PET, PVC, PP, PS, PC, PE) particles in five water (pure water, rain water, lake water, tap water, and sea water) environments was realized. The results show that the average test accuracy of the trained algorithm is as high as 99.1%, which is better than 93.95% and 74.55% of the classical machine learning algorithms support vector machine (SVM) and back propagation (BP) neural network. Success rate indicates that the proposed method can be used to identify the MP samples.",NA,10.1109/JSTQE.2022.3222065,"Raman;Spectrum Analysis;Spectrum Analysis, Raman",NA,NA
rayyan-735664839,Perfluoroalkyl Compounds,2009,NA,NA,Persistent Organic Pollutants,NA,NA,NA,25-69,NA,https://www.scopus.com/inward/record.uri?eid=2-s2.0-80053414527&doi=10.1002%2f9780470684122.ch3&partnerID=40&md5=5f73e62f65bb598e07e0962369272613,NA,NA,NA,NA,NA,10.1002/9780470684122.ch3,Carboxylation;Sulfur compounds;Amides;Perfluorocarboxylic acid;Perfluoroalkyl compounds;Fluorotelomer carboxylic acids;Fluorotelomer alcohols (FTOHs);Fluorotelomer carboxylic acids/fluorotelomer carboxylates;Perfluoroalkylsulfonic acids/perfluoroalkylsulfonates (PFSAs);Perfluorocarboxylic acids/perfluorocarboxylates (PFCAs);Polyfluorinated sulfonamides (FSAs),NA,NA
rayyan-735664315,Perfluoroalkyl substances (PFASs) in special management sea areas of Korea: Distribution and bioconcentration in edible fish species,2020,NA,NA,Marine Pollution Bulletin,NA,156,NA,NA,NA,https://www.scopus.com/inward/record.uri?eid=2-s2.0-85084739442&doi=10.1016%2fj.marpolbul.2020.111236&partnerID=40&md5=23cacf44bb96173f943a5e0c64e27b58,NA,NA,NA,"Thirteen PFASs in water (n = 58), sediment (n = 58) and edible fish samples (n = 81) collected from three special management sea areas of Korea including Gwangyang bay, Masan bay and Busan harbor in July 2018 were investigated. The mean PFASs concentration in water (ng/L) were in order Masan (5.09) > Busan (2.82) > Gwangyang (1.74). PFASs levels were found as the low concentration in sediment. The greatest total PFASs concentration in each fish tissue was found as 3.04 (ng/g ww) in a Japanese amberjack fish for muscle in Busan, 66.23 (ng/mL) in Japanese amberjack fish for blood in Masan and 125.03 (ng/g ww) flathead grey mullet in Busan bay. The BCF (L/kg) of PFDoDA was found as the highest in muscle of all species with values from 30,922 (grey mullet in Gwangyang) to 69,131 (grey mullet in Busan). PFDS was the highest BCF's PFASs (110,599 L/kg) in muscle which was found in Japanese amberjack in Busan bay. © 2020 Elsevier Ltd",NA,10.1016/j.marpolbul.2020.111236,Fish;Alkanesulfonic Acids;Fluorocarbons;PFOS;PFASs;Animals;Article;Environmental Monitoring;Perfluoroalkyl substances;Bioaccumulation;Korea;animal;concentration (parameter);female;fluorocarbon;male;nonhuman;unclassified drug;controlled study;bioaccumulation;environmental monitoring;animal tissue;perfluoro compound;water pollutant;Muscle;fish;perfluorodecanoic acid;perfluorododecanoic acid;perfluorooctanoic acid;perfluorotridecanoic acid;perfluoroundecanoic acid;spatial distribution;concentration (composition);South Korea;alkanesulfonic acid;perfluoroalkyl substance;high performance liquid chromatography;solid phase extraction;perfluorohexanesulfonic acid;perfluorohexanoic acid;sulfonic acid derivative;muscle;mass spectrometry;Republic of Korea;blood;perfluorononanoic acid;perfluoroheptanoic acid;perfluorotetradecanoic acid;organofluorine;sediment;multiple reaction monitoring;PFOA;Low concentrations;perfluorodecane sulfonic acid;pH;decanoic acid derivative;marine sediment;perfluorobutane sulfonic acid;Mugil cephalus;Water Pollutants;Chemical;Bioconcentration;Bioconcentration factor;Fish species;Fish tissue;heptanoic acid derivative;Fish samples;edible species;Kathetostoma giganteum;Konosirus punctatus;Kwangyang Bay;Masan Bay;Mugilidae;myristic acid derivative;Oplegnathus fasciatus;perfluoroctane sulfonic acid;Pusan [Pusan (ADS)];Pusan [South Korea];Sea areas;Sebastes;Sebastes schlegelil;Seriola quinqueradiata;South Cholla;South Kyongsang,NA,NA
rayyan-735664093,Online extraction based on ionic covalent organic framework for sensitive determination of trace per- and polyfluorinated alkyl substances in seafoods by UHPLC-MS/MS,2021,NA,NA,Food Chemistry,NA,362,NA,NA,NA,https://www.scopus.com/inward/record.uri?eid=2-s2.0-85107118262&doi=10.1016%2fj.foodchem.2021.130214&partnerID=40&md5=9b1b7a377421dd6723648b1d5ae5e7dd,NA,NA,NA,"The ionic covalent organic framework (TPB-BFBIm-iCOF) was facilely synthetized by the size-controllable confinement method and chosen as the online solid phase extraction (SPE) adsorbent. This adsorbent showed fast adsorption equilibrium (5 min) and high adsorption capacity (87.7–140.8 mg g−1) for the per- and polyfluorinated alkyl substances (PFASs). The TPB-BFBIm-iCOF microsphere revealed the satisfactory enrichment performance for PFASs by means of the electrostatic interaction, hydrophobic effect and ordered channel structure. After extraction, the loaded TPB-BFBIm-iCOF-online SPE column was eluted and applied to the ultrahigh performance liquid chromatography tandem mass spectrometry analysis. Under the optimum conditions, the method displayed satisfactory linearity (R2 ≥ 0.9910) and low limits of detection (≤0.0017 ng g−1) for five seafoods. The relative recoveries of PFASs were 85.3%–109.4% with the relative standard deviation ≤ 9.9%. The method exhibited potential value in monitoring the toxicokinetics and environmental behaviors of PFASs. © 2021 Elsevier Ltd",NA,10.1016/j.foodchem.2021.130214,Article;Chromatography;High Pressure Liquid;Food Contamination;Hydrocarbons;Adsorption;food contamination;alkyl group;chemistry;Extraction;Liquid chromatography;Mass spectrometry;Phase separation;fish;liquid chromatography-mass spectrometry;high performance liquid chromatography;Meats;Polyfluorinated alkyl substances;procedures;solid phase extraction;Solid Phase Extraction;tandem mass spectrometry;Tandem Mass Spectrometry;desorption;adsorbent;adsorption;Solid-phase extraction;toxicokinetics;limit of detection;multiple reaction monitoring;elemental analysis;electrospray;Fourier transform infrared spectroscopy;food analysis;extraction;carbon nuclear magnetic resonance;particle size;Limit of Detection;surface area;sea food;Seafood;Food Analysis;Hydrophobicity;shrimp;shellfish;fluorinated hydrocarbon;scanning electron microscopy;Column chromatography;contact angle;microsphere;Per-;Fluorinated;polyfluorinated alkyl substance;polyfluorinated alkyl substances;Covalent organic frameworks;crystal structure;density functional theory;cephalopod;isotherm;Adsorption equilibrium;Density Functional Theory;High adsorption capacity;Ionic covalent organic framework;Microsphere;Microspheres;Online extraction;Online solid phase extraction;photon correlation spectroscopy;pore volume;Seafoods;seaweed;Size-controllable;X ray powder diffraction;Multiple Sclerosis,NA,NA
rayyan-735662785,Perfluorooctane sulfonate (PFOS) enhanced polystyrene particles uptake by human colon adenocarcinoma Caco-2 cells,NA,NA,NA,NA,NA,NA,NA,NA,NA,NA,NA,NA,NA,NA,NA,10.1016/j.scitotenv.2022.157640,Adenocarcinoma;Humanism;Humanities;Humans;Sulfones,NA,NA
rayyan-735664072,The occurrence of perfluoroalkyl substances (PFAS) in drinking water in the Czech Republic: a pilot study,2022,NA,NA,Environmental Science and Pollution Research,NA,29,40,60341-60353,NA,https://www.scopus.com/inward/record.uri?eid=2-s2.0-85128094851&doi=10.1007%2fs11356-022-20156-7&partnerID=40&md5=a57869a53f55b553a1699b3229ae29e2,NA,NA,NA,"Drinking water is one of the main contributors to overall human exposure to per- and polyfluoroalkyl substances (PFAS), a broad group of environmental contaminants with arising concerns on the impact on human health; therefore, it is necessary to monitor its quality. Here, we present a solid-phase extraction-based method to determine 22 PFAS in water, using 100 mL of the sample. The instrumental analysis employing an ultra-high-performance liquid chromatography coupled with tandem mass spectrometry achieved low limits of quantification (0.025–0.25 ng/L). The validated method (recoveries 70–120% and repeatabilities ≤ 20% at tested concentrations (0.05, 0.1 and 0.5 ng/L)) was applied to 67 tap water and 31 bottled water samples collected in the Czech Republic. The most abundant compounds were perfluorononanoic acid (88% positives; 0.034–13.3 ng/L) and perfluoroheptanoic acid (23% positives; 0.035–0.106 ng/L), respectively. ∑PFAS in positive samples ranged from 0.029 to 300 ng/L (99% positives, median 2.34 ng/L) in tap water data and 0.033 to 4.48 ng/L (32% positives, median 0.097 ng/L) in bottled water samples. Current-use fluoroalkyl ethers, dodecafluoro-3H-4,8-dioxanonanoate and 11-chloroeicosafluoro-3-oxaundecane-1-sulfonate, were occasionally detected in tap. Based on the median data, PFAS intake by an adult from a tap or bottled water represented units of % of the tolerable weekly intake set by the European Food Safety Authority and therefore did not represent a severe risk. The described method and obtained first data on PFAS in the Czech drinking water provided a solid basis for an ongoing national study on the presence of PFAS in tap water. © 2022, The Author(s), under exclusive licence to Springer-Verlag GmbH Germany, part of Springer Nature.",NA,10.1007/s11356-022-20156-7,PFAS;Fluorocarbons;Humans;Pilot Projects;fluorocarbon;pollutant;chemistry;water pollutant;pollution exposure;adult;human;Solid-phase extraction;Adult;drinking water;Drinking Water;pilot study;Exposure;Czech Republic;UHPLC-MS/MS;Water Pollutants;Chemical;Tap water;Bottled water;health care;Drinking,NA,NA
rayyan-735663226,Uptake of perfluorinated compounds by plants grown in nutrient solution,NA,NA,NA,NA,NA,NA,NA,NA,NA,NA,NA,NA,NA,NA,NA,10.1016/j.scitotenv.2013.10.054,character(0),NA,NA
rayyan-735663827,On-site rapid detection of perfluorooctanoic acid by visual immunochromatographic strip biosensor in domestic water and real human samples,2024,NA,NA,Environmental Pollution,NA,348,NA,NA,NA,https://www.scopus.com/inward/record.uri?eid=2-s2.0-85188812319&doi=10.1016%2fj.envpol.2024.123776&partnerID=40&md5=3e04ddf00eff66b81a52ecfe1a58735b,NA,NA,NA,"The International Agency for Research on Cancer (IARC) classifies PFOA as a Class 1 carcinogen. Here, a new naked-eye PFOA immunochromographic strip was developed to recognize PFOA in domestic water and real human samples within 10 min based on a novel custom designed anti-PFOA monoclonal antibody (mAb) 2A3, which was firstly an immune rapid detection method for PFOA has been proposed. Using computer simulation techniques such as quantum computing to assist in designing the structural formula of PFOA semi antigen, which hapten was firstly proposed. The half maximal inhibitory concentration of PFOA monoclonal antibody (mAb) 2A3 was 2.4 μg/mL. Using mAb 2A3, we developed an immunochromatographic strip (ICS) for detecting PFOA in real samples. The developed method generated results in 10 min, with visual detection limits of 20, 20, and 200 μg/mL and limit of detection of 50, 200, and 500 μg/mL for water, blood and urine samples, respectively. The established ICS and indirect competitive enzyme-linked immunosorbent assay were used to analyze the actual samples, and the results were confirmed by LC-MS/MS. Our study findings showed that the ICS and ic-ELISA can quickly detect PFOA in actual samples. © 2024 Elsevier Ltd",NA,10.1016/j.envpol.2024.123776,Perfluorooctanoic acid;PFOA;Chemical detection;Monoclonal antibody;International cooperation;Class 1;Computer simulation;Detection methods;Domestic water;Immunochromatographic strip;Immunochromatographic strips;International agency for research on cancers;Monoclonal antibodies;Naked-eye;Quantum computers;Rapid detection;Strip biosensor;Humanities;Humanism;Humans;Biosensing Techniques,NA,NA
rayyan-735663753,Extravillous trophoblast migration and invasion: Impact of environmental chemicals and pharmaceuticals,2022,NA,NA,REPRODUCTIVE TOXICOLOGY,"[""0890-6238"", ""1873-1708""]",107,NA,60-68,NA,NA,NA,NA,NA,"During pregnancy, the migration and invasion of extravillous trophoblasts (EVTs) into the maternal uterus is essential for proper development of the placenta and fetus. During the first trimester, EVTs engraft and remodel maternal spiral arteries allowing for efficient blood flow and the transfer of essential nutrients and oxygen to the fetus. Aberrant migration of EVTs leading to either shallow or deep invasion into the uterus has been implicated in a number of gestational pathologies including preeclampsia, fetal growth restriction, and placenta accreta spectrum. The migration and invasion of EVTs is well-coordinated to ensure proper placentation. However, recent data point to the ability of xenobiotics to disrupt EVT migration. These xenobiotics include heavy metals, endocrine disrupting chemicals, and organic contaminants and have often been associated with adverse pregnancy outcomes. In most instances, xenobiotics appear to reduce EVT migration; however, there are select examples of enhanced motility after chemical exposure. In this review, we provide an overview of the 1) current experimental approaches used to evaluate EVT migration and invasion in vitro, 2) ability of environmental chemicals and pharmaceuticals to enhance or retard EVT motility, and 3) signaling pathways responsible for altered EVT migration that are sensitive to disruption by xenobiotics.",NA,10.1016/j.reprotox.2021.11.008,Environment,NA,NA
rayyan-735664585,Perfluorinated substances and telomeres in an Arctic seabird: Cross-sectional and longitudinal approaches,2017,NA,NA,Environmental Pollution,NA,230,NA,360-367,NA,https://www.scopus.com/inward/record.uri?eid=2-s2.0-85021390203&doi=10.1016%2fj.envpol.2017.06.060&partnerID=40&md5=5703de6e324ab1676ba73998e5db5162,NA,NA,NA,"Telomeres are non-coding DNA repeats located at the termini of eukaryotic chromosomes, regulated by dynamic processes balancing shortening and maintenance. Despite a mechanism to slow-down telomere shortening, cell division leads to progressive attrition of chromosomes, leading to the onset of cellular senescence or apoptosis. However, telomere restoration based on telomerase activity is the primary mechanism for telomere maintenance. Telomere length is associated to health and survival and can be impacted by a broad panel of environmental factors. However, the effect of contaminants on telomeres is poorly known for living organisms. The aim of this study was to investigate relationships between some poly- and perfluoroalkyl substances (PFASs), body condition and telomere length by using both a cross-sectional and longitudinal approach in adult breeding Black-legged kittiwakes (Rissa tridactyla) from Svalbard. First, we examined the associations between absolute telomere length and PFASs contamination in a given year (cross-sectional approach). Second, we investigated the relationships between telomere dynamics and PFASs contamination within a two years’ time frame (longitudinal approach). Our results did not show any significant relationships of PFASs and body condition with absolute telomere length in a given year. Surprisingly, we found a positive and significant relationship between PFASs and telomere dynamics in both sexes with elongated telomere in birds bearing the highest concentrations of PFASs. Our study underlines (i) the need to investigate PFAS effects on telomere dynamics with a longitudinal approach and (ii) a potential positive effect of these contaminants on telomere length, with the most contaminated birds showing the slowest rate of telomere shortening or even displaying elongated ones. Our study is the first to report a relationship between PFASs and telomere length in free-living vertebrates. A possible underlying mechanism and other potential confounding factors are discussed. © 2017 Elsevier Ltd",NA,10.1016/j.envpol.2017.06.060,Fluorocarbons;Rissa tridactyla;Svalbard;Organic contaminants;Birds;PFASs;Black-legged kittiwake;DNA;Animals;Article;Environmental Monitoring;animal;Arctic;Arctic Regions;Cell proliferation;Charadriiformes;female;fluorocarbon;male;nonhuman;seabird;sex difference;bioaccumulation;environmental monitoring;telomere;Telomere;telomere length;perfluoro compound;breeding;perfluorodecanoic acid;perfluorododecanoic acid;perfluorooctanesulfonic acid;perfluorooctanoic acid;perfluoroundecanoic acid;perfluorohexanesulfonic acid;perfluorohexanoic acid;Contamination;longitudinal study;water contamination;perfluorononanoic acid;metabolism;organofluorine;Organic contaminant;organic pollutant;Aves;Cross-Sectional Studies;cross-sectional study;perfluoropentane;Vertebrata;perflubutane;body constitution;concentration (parameters);chromosome;Chromosomes;telomere shortening;Jan Mayen;Cell death;Environmental factors;Dynamics;perfluoroalkyl substance (PFASs);Poly;Eukaryota;Eukaryotic chromosomes;Telomere maintenance;Cesarean Section,NA,NA
rayyan-735663512,Susceptibility of <i>Sardinella lemuru</i> to emerging marine microplastic pollution,2020,NA,NA,GLOBAL JOURNAL OF ENVIRONMENTAL SCIENCE AND MANAGEMENT-GJESM,2383-3572,6,3,373-384,NA,NA,NA,NA,NA,"Marine microplastics are emerging pollutants that impact across levels of marine food chain at a global scale. Its presence was determined on Sardinella lemuru, a commercial pelagic fish that are harvested generally in the Northern Mindanao, consumed locally, and exported worldwide as bottled or canned sardine products. The stomach contents of 600 sardines were examined visually under a microscope, stained with Rose Bengal, and tested with hot needle technique to identify ingested microplastics. These anthropogenic particles were measured and physically classified into fibers, fragments, and films. Results of this study showed that 85% of S. lemuru were already contaminated with 3.74 +/- 3.92 # of microplastics even before being processed into various sardine products. These microplastics ranged from 0.12 to 21.30 mm and 80 % were mostly < 2.5 mm size classes. The dominant microplastics were 97.94 % in the form of fibers while 1.52 % and 0.54 % were respectively classified into fragments and films. Method validation by isolating microplastics from spiked samples (n = 30) with three retrieval attempts showed 100% recovery efficiency. While results from Canonical Correspondence Analysis of ingested microplastic data had no relationship with the standard lengths of the sardine and the masses of ingested food materials at varying size classes, the total number of ingested microplastics from 2014 to 2016 were directly correlated (r(2)=0.91, p=0.003) with the human population at the landing sites along the coastline of northern Mindanao. (c) 2020 GJESM. All rights reserved.",NA,10.22034/gjesm.2020.03.07,Military Personnel,NA,NA
